NSX, Description, New Price, Discount percent, Old Price, 
Hatomugi, Sữa Tắm Hatomugi Dưỡng Ẩm, 80.000 ₫, 65%, 230.000 ₫, 
Dove, Smoothie Tẩy Da Chết Dove Hương Lựu Đỏ 298g, 149.000 ₫, 25%, 199.000 ₫, 
Cocoon, Túi Refill Tẩy Da Chết Toàn Thân Cocoon Sạch Da 600ml, 292.000 ₫, 10%, 325.000 ₫, 
Dove, Serum Ngăn Mùi Dove Giúp Da Sáng Mịn Đều Màu 40ml, 65.000 ₫, 33%, 97.000 ₫, 
EtiaXil, Lăn Khử Mùi EtiaXil Nhãn Xanh Cho Da Nhạy Cảm 15ml, 159.000 ₫, 50%, 320.000 ₫, 
Vaseline, Sữa Dưỡng Thể Vaseline Sáng Da Chuyên Sâu Ban Đêm 330ml, 113.000 ₫, 25%, 150.000 ₫, 
Vaseline, Combo 2 Sữa Dưỡng Thể Vaseline Sáng Mịn Da 330ml, 225.000 ₫, 25%, 300.000 ₫, 
Vaseline, Serum Dưỡng Thể Vaseline Chống Nắng Sáng Da 300ml (Mới), 136.000 ₫, 33%, 203.000 ₫, 
Cocoon, Tẩy Da Chết Toàn Thân Cocoon Cà Phê Đắk Lắk 200ml, 100.000 ₫, 20%, 125.000 ₫, 
Dove, Smoothie Tẩy Da Chết Dove Hương Hoa Anh Đào 298g, 149.000 ₫, 25%, 199.000 ₫, 
Cocoon, Combo Cocoon Tẩy Da Chết Cho Mặt & Toàn Thân Từ Cà Phê Đắk Lắk (200ml+150ml), 221.000 ₫, 24%, 290.000 ₫, 
Lifebuoy, Sữa Tắm Lifebuoy Detox Matcha & Khổ Qua 800g, 153.000 ₫, 22%, 195.000 ₫, 
Dove, Serum Ngăn Mùi Dove Giúp Mờ Thâm Thu Nhỏ Lỗ Chân Lông 40ml, 65.000 ₫, 33%, 97.000 ₫, 
Vaseline, Sữa Dưỡng Thể Vaseline Gluta-Hya Nâng Tông Tức Thì 300ml, 134.000 ₫, 31%, 195.000 ₫, 
Nivea, Sữa Dưỡng Thể Nivea Sáng Da Ban Đêm Từ 8 Super Food 350ml, 99.000 ₫, 29%, 139.000 ₫, 
Secret Key, Kem Tắm Secret Key Dưỡng Sáng Da Mặt Và Cơ Thể 200g, 238.000 ₫, 46%, 440.000 ₫, 
Paula's Choice, Kem Dưỡng Thể Paula's Choice Giảm Viêm Lỗ Chân Lông 210ml, 645.000 ₫, 32%, 950.000 ₫, 
Dove, Smoothie Tẩy Da Chết Dove Đường Nâu & Hương Dừa 298g, 149.000 ₫, 40%, 250.000 ₫, 
Exclusive Cosmetic, Tẩy Da Chết Toàn Thân Exclusive Cosmetic Quế Hồi Cafe 380g, 75.000 ₫, 50%, 149.000 ₫, 
Cetaphil, Sữa Tắm Gội Cetaphil Dịu Lành Cho Bé Tinh Chất Hoa Cúc 400ml, 248.000 ₫, 18%, 301.000 ₫, 
Bioré, Serum Chống Nắng Dưỡng Thể Bioré Sáng Mịn Mát Lạnh 150ml, 151.000 ₫, 30%, 216.000 ₫, 
Cléo, Kem Tẩy Lông Cléo Dành Cho Da Nhạy Cảm 50g, 49.000 ₫, 36%, 76.000 ₫, 
Johnson's, Sữa Tắm Johnson's Adult 2 Trong 1 Cấp Ẩm Cho Người Lớn 750ml, 128.000 ₫, 25%, 171.000 ₫, 
Sunplay, Lotion Chống Nắng Sunplay Dưỡng Thể Sáng Mịn 150g, 161.000 ₫, 21%, 204.000 ₫, 
Cocoon, Combo Tẩy Da Chết Toàn Thân Cocoon Cà Phê Đắk Lắk 200mlx2, 195.000 ₫, 22%, 250.000 ₫, 
Hatomugi, Sữa Dưỡng Thể Hatomugi Làm Sáng Da Ban Đêm 400ml, 90.000 ₫, 62%, 239.000 ₫, 
Old Spice, Sáp Khử Mùi Old Spice Giảm Tiết Mồ Hôi Hương Fiji 73g, 129.000 ₫, 16%, 154.000 ₫, 
Paula's Choice, Kem Dưỡng Thể Paula’s Choice 10% AHA Làm Sáng Da 210ml, 495.000 ₫, 48%, 950.000 ₫, 
Hazeline, Sữa Tắm Hazeline Sáng Mịn Dưỡng Ẩm Yến Mạch & Dâu Tằm 1kg, 88.000 ₫, 37%, 139.000 ₫, 
La Roche-Posay, Gel Rửa Mặt & Tắm La Roche-Posay Làm Sạch & Giảm Mụn 400ml, 492.000 ₫, 18%, 600.000 ₫, 
Old Spice, Sáp Khử Mùi Old Spice Hương Pure Sport Năng Động 85g (Đỏ), 98.000 ₫, 25%, 130.000 ₫, 
A Bonne, Muối Tắm A Bonne Sữa Bò Làm Sáng & Mềm Mịn Da 350g, 18.000 ₫, 67%, 55.000 ₫, 
Old Spice, Sáp Khử Mùi Old Spice Giảm Tiết Mồ Hôi Hương Timber 73g, 123.000 ₫, 20%, 154.000 ₫, 
Vaseline, Sữa Dưỡng Thể Vaseline Dịu Mát Sáng Da 350ml, 99.000 ₫, 34%, 150.000 ₫, 
Angel's Liquid, Lăn Nách Angel's Liquid Mờ Thâm, 299.000 ₫, 40%, 499.000 ₫, 
Some By Mi, Sữa Tắm Some By Mi Làm Sạch Mụn Cơ Thể 400g, 276.000 ₫, 30%, 395.000 ₫, 
Hatomugi, Kem Dưỡng Tay Hatomugi Cấp Ẩm Mềm Mịn & Ngừa Nếp Nhăn 65g, 41.000 ₫, 59%, 100.000 ₫, 
Cocoon, Combo Cocoon Big Size Tẩy Da Chết Toàn Thân 600ml & Mặt Từ Cà Phê Đắk Lắk 150ml, 325.000 ₫, 34%, 490.000 ₫, 
Vichy, Lăn Khử Mùi Vichy Ngăn Mồ Hôi, 240.000 ₫, 19%, 295.000 ₫, 
Bioré, Serum Chống Nắng Dưỡng Thể Bioré Sáng Da Mịn Màng 150ml, 162.000 ₫, 25%, 216.000 ₫, 
Hatomugi, Sữa Tắm Hatomugi Dưỡng Ẩm, 80.000 ₫, 65%, 230.000 ₫, 
Dove, Smoothie Tẩy Da Chết Dove Hương Lựu Đỏ 298g, 149.000 ₫, 25%, 199.000 ₫, 
Cocoon, Túi Refill Tẩy Da Chết Toàn Thân Cocoon Sạch Da 600ml, 292.000 ₫, 10%, 325.000 ₫, 
Dove, Serum Ngăn Mùi Dove Giúp Da Sáng Mịn Đều Màu 40ml, 65.000 ₫, 33%, 97.000 ₫, 
EtiaXil, Lăn Khử Mùi EtiaXil Nhãn Xanh Cho Da Nhạy Cảm 15ml, 159.000 ₫, 50%, 320.000 ₫, 
Vaseline, Sữa Dưỡng Thể Vaseline Sáng Da Chuyên Sâu Ban Đêm 330ml, 113.000 ₫, 25%, 150.000 ₫, 
Vaseline, Combo 2 Sữa Dưỡng Thể Vaseline Sáng Mịn Da 330ml, 225.000 ₫, 25%, 300.000 ₫, 
Vaseline, Serum Dưỡng Thể Vaseline Chống Nắng Sáng Da 300ml (Mới), 136.000 ₫, 33%, 203.000 ₫, 
Cocoon, Tẩy Da Chết Toàn Thân Cocoon Cà Phê Đắk Lắk 200ml, 100.000 ₫, 20%, 125.000 ₫, 
Dove, Smoothie Tẩy Da Chết Dove Hương Hoa Anh Đào 298g, 149.000 ₫, 25%, 199.000 ₫, 
Cocoon, Combo Cocoon Tẩy Da Chết Cho Mặt & Toàn Thân Từ Cà Phê Đắk Lắk (200ml+150ml), 221.000 ₫, 24%, 290.000 ₫, 
Lifebuoy, Sữa Tắm Lifebuoy Detox Matcha & Khổ Qua 800g, 153.000 ₫, 22%, 195.000 ₫, 
Dove, Serum Ngăn Mùi Dove Giúp Mờ Thâm Thu Nhỏ Lỗ Chân Lông 40ml, 65.000 ₫, 33%, 97.000 ₫, 
Vaseline, Sữa Dưỡng Thể Vaseline Gluta-Hya Nâng Tông Tức Thì 300ml, 134.000 ₫, 31%, 195.000 ₫, 
Nivea, Sữa Dưỡng Thể Nivea Sáng Da Ban Đêm Từ 8 Super Food 350ml, 99.000 ₫, 29%, 139.000 ₫, 
Johnson's, Sữa Tắm Johnson's Adult Từ Hạnh Nhân Cho Người Lớn 750ml, 133.000 ₫, 22%, 171.000 ₫, 
Milaganics, Gel Nha Đam Milaganics Dưỡng Ẩm & Làm Mềm Da 300ml, 62.000 ₫, 66%, 184.000 ₫, 
Sunplay, Lotion Chống Nắng Sunplay Dưỡng Thể Mát Lạnh 150g, 163.000 ₫, 20%, 204.000 ₫, 
St.Ives, Sữa Tắm St.Ives Dưỡng Ẩm Da Yến Mạch & Bơ Hạt Mỡ 650ml, 159.000 ₫, 12%, 180.000 ₫, 
Cetaphil, Sữa Tắm Gội Cetaphil Dịu Lành Cho Bé 400ml, 209.000 ₫, 15%, 245.000 ₫, 
Vaseline, Sữa Dưỡng Thể Vaseline Dưỡng Sáng Da Rạng Rỡ 350ml, 108.000 ₫, 28%, 150.000 ₫, 
On: The Body, Sữa Tắm On: The Body Dưỡng Ẩm Hương Tinh Tế 1000g, 230.000 ₫, 10%, 255.000 ₫, 
Nerman, Sữa Tắm Gội Nerman Hương Nước Hoa Cao Cấp 350ml, 199.000 ₫, 5%, 209.000 ₫, 
Nivea, Combo Sữa Dưỡng Thể Nivea Phục Hồi & Dưỡng Sáng Da Ngày & Đêm (350ml/chai), 253.000 ₫, 5%, 266.000 ₫, 
Bio-Oil, Dầu Chăm Sóc Da Bio-Oil Làm Giảm Rạn Da, 402.000 ₫, 9%, 440.000 ₫, 
Vaseline, Sữa Dưỡng Thể Vaseline Ngăn Ngừa Lão Hoá 350ml, 99.000 ₫, 34%, 150.000 ₫, 
Cléo, Kem Giảm Thâm Nách & Khử Mùi Cléo Dưỡng Sáng 6 Trong 1 35g, 154.000 ₫, 17%, 186.000 ₫, 
Avène, Kem Dưỡng Avène Giảm Khô Ngứa Cho Da Viêm Thể Tạng 200ml, 542.000 ₫, 27%, 739.000 ₫, 
Hazeline, Sữa Tắm Hazeline Sáng Mịn Rạng Ngời Matcha & Lựu Đỏ 1kg, 88.000 ₫, 37%, 139.000 ₫, 
Bio-Oil, Dầu Chăm Sóc Da Bio-Oil Làm Giảm Rạn Da, 165.000 ₫, 13%, 190.000 ₫, 
Vichy, Lăn Khử Mùi Vichy Ngăn Mồ Hôi, 236.000 ₫, 20%, 295.000 ₫, 
Hatomugi, Sữa Dưỡng Thể Hatomugi Chống Nắng Dưỡng Ẩm SPF50+ PA++++ 250ml, 145.000 ₫, 56%, 329.000 ₫, 
EtiaXil, Lăn Khử Mùi EtiaXil Nhãn Đỏ Dành Cho Da Khoẻ 15ml, 162.000 ₫, 49%, 320.000 ₫, 
Tesori d'Oriente, Sữa Tắm Nước Hoa Tesori d'Oriente Hương Hoa Sen 500ml, 229.000 ₫, 17%, 275.000 ₫, 
Dove, Sữa Tắm Dưỡng Thể Dove Dưỡng Ẩm Chuyên Sâu 900g, 168.000 ₫, 26%, 226.000 ₫, 
Neutrogena, Sữa Tắm Neutrogena Dưỡng Ẩm & Tươi Mới Dạng Gel 473ml, 235.000 ₫, 20%, 295.000 ₫, 
Eucerin, Sữa Tắm Eucerin Dịu Nhẹ Cho Da Nhạy Cảm 1000ml, 438.000 ₫, 12%, 499.000 ₫, 
Dove, Sữa Tắm Dưỡng Thể Dove Da Ẩm Mịn Lưu Hương Ngọt Ngào 900g, 169.000 ₫, 25%, 226.000 ₫, 
On: The Body, Sữa Tắm On: The Body Dưỡng Ẩm Hương Thư Giãn 1000g, 178.000 ₫, 30%, 255.000 ₫, 
Banana Boat, Xịt Chống Nắng Banana Boat Thể Thao SPF 100 PA+++ 170g, 218.000 ₫, 22%, 280.000 ₫, 
Pelican, Xà Phòng Pelican Làm Giảm Mụn Và Thâm Mông 80g, 75.000 ₫, 56%, 169.000 ₫, 
EtiaXil, Lăn Khử Mùi EtiaXil Nhãn Nâu Cho Da Siêu Nhạy Cảm 15ml, 162.000 ₫, 49%, 320.000 ₫, 
Old Spice, Sáp Khử Mùi Old Spice Giảm Tiết Mồ Hôi Hương Wolfthorn 73g, 123.000 ₫, 20%, 154.000 ₫, 
Angel's Liquid, Xịt Giảm Mụn Lưng Angel's Liquid Dưỡng Sáng Cơ Thể 150ml, 399.000 ₫, 43%, 699.000 ₫, 
Milaganics, Dầu Dừa Milaganics Ép Lạnh Tinh Khiết 250ml, 90.000 ₫, 57%, 210.000 ₫, 
Vaseline, Sữa Dưỡng Thể Vaseline Bảo Vệ Sáng Mịn Ban Ngày 330ml, 108.000 ₫, 28%, 150.000 ₫, 
Cetaphil, Sữa Dưỡng Ẩm Cetaphil Dịu Lành Cho Bé 400ml, 267.000 ₫, 17%, 320.000 ₫, 
Pelican, Xà Phòng Pelican Làm Giảm Mụn Lưng 135g, 79.000 ₫, 47%, 149.000 ₫, 
Vaseline, Sữa Dưỡng Thể Vaseline Chống Nắng Và Sáng Da 350ml, 99.000 ₫, 34%, 150.000 ₫, 
EtiaXil, Xịt Khử Mùi EtiaXil Dạng Phun Sương 48H Màu Xanh 150ml, 209.000 ₫, 16%, 249.000 ₫, 
Vaseline, Combo 2 Sữa Dưỡng Thể Vaseline Sáng Da Chuyên Sâu Ban Đêm 330ml, 226.000 ₫, 25%, 300.000 ₫, 
Old Spice, Sáp Khử Mùi Old Spice Giảm Tiết Mồ Hôi Hương Bearglove 73g, 128.000 ₫, 17%, 154.000 ₫, 
Nivea, Xịt Khử Mùi Nivea Cho Nữ Sáng Da, 95.000 ₫, 12%, 108.000 ₫, 
Old Spice, Sáp Khử Mùi Old Spice Hương Fresh Tươi Mát 85g, 118.000 ₫, 9%, 130.000 ₫, 
Bio-Oil, Dầu Chăm Sóc Da Bio-Oil Làm Giảm Rạn Da, 293.000 ₫, 11%, 330.000 ₫, 
Hatomugi, Sữa Tắm Hatomugi Dưỡng Ẩm, 80.000 ₫, 65%, 230.000 ₫, 
Dove, Smoothie Tẩy Da Chết Dove Hương Lựu Đỏ 298g, 149.000 ₫, 25%, 199.000 ₫, 
Cocoon, Túi Refill Tẩy Da Chết Toàn Thân Cocoon Sạch Da 600ml, 292.000 ₫, 10%, 325.000 ₫, 
Dove, Serum Ngăn Mùi Dove Giúp Da Sáng Mịn Đều Màu 40ml, 65.000 ₫, 33%, 97.000 ₫, 
EtiaXil, Lăn Khử Mùi EtiaXil Nhãn Xanh Cho Da Nhạy Cảm 15ml, 159.000 ₫, 50%, 320.000 ₫, 
Vaseline, Sữa Dưỡng Thể Vaseline Sáng Da Chuyên Sâu Ban Đêm 330ml, 113.000 ₫, 25%, 150.000 ₫, 
Vaseline, Combo 2 Sữa Dưỡng Thể Vaseline Sáng Mịn Da 330ml, 225.000 ₫, 25%, 300.000 ₫, 
Vaseline, Serum Dưỡng Thể Vaseline Chống Nắng Sáng Da 300ml (Mới), 136.000 ₫, 33%, 203.000 ₫, 
Cocoon, Tẩy Da Chết Toàn Thân Cocoon Cà Phê Đắk Lắk 200ml, 100.000 ₫, 20%, 125.000 ₫, 
Dove, Smoothie Tẩy Da Chết Dove Hương Hoa Anh Đào 298g, 149.000 ₫, 25%, 199.000 ₫, 
Cocoon, Combo Cocoon Tẩy Da Chết Cho Mặt & Toàn Thân Từ Cà Phê Đắk Lắk (200ml+150ml), 221.000 ₫, 24%, 290.000 ₫, 
Lifebuoy, Sữa Tắm Lifebuoy Detox Matcha & Khổ Qua 800g, 153.000 ₫, 22%, 195.000 ₫, 
Dove, Serum Ngăn Mùi Dove Giúp Mờ Thâm Thu Nhỏ Lỗ Chân Lông 40ml, 65.000 ₫, 33%, 97.000 ₫, 
Vaseline, Sữa Dưỡng Thể Vaseline Gluta-Hya Nâng Tông Tức Thì 300ml, 134.000 ₫, 31%, 195.000 ₫, 
Nivea, Sữa Dưỡng Thể Nivea Sáng Da Ban Đêm Từ 8 Super Food 350ml, 99.000 ₫, 29%, 139.000 ₫, 
Nuxe, Kem Dưỡng Da Tay Và Móng Nuxe Không Nhờn Rít 50ml, 234.000 ₫, 12%, 265.000 ₫, 
Milaganics, Bột Đậu Đỏ Milaganics Ngừa Mụn, 20.000 ₫, 52%, 42.000 ₫, 
A Bonne, Muối Tắm A Bonne Vitamin C Chiết Xuất Đu Đủ & Chanh 350g, 18.000 ₫, 67%, 55.000 ₫, 
Cléo, Kem Tẩy Lông Viền Bikini Cléo Từ Khoai Tây & Mật Ong 50g, 110.000 ₫, 17%, 132.000 ₫, 
Dove, Sữa Tắm Dưỡng Thể Dove Phục Hồi Độ Ẩm Da Khô 500g, 117.000 ₫, 18%, 142.500 ₫, 
Dove, Xịt Khử Mùi Dove Dưỡng Da Sáng Mịn Hương Phấn Thơm 150ml, 99.000 ₫, 21%, 125.000 ₫, 
White Conc, Kem Dưỡng Thể White Conc Làm Sáng Da Toàn Thân 200g, 188.000 ₫, 46%, 350.000 ₫, 
Veet, Kem Tẩy Lông Veet Silk & Fresh Dành Cho Da Nhạy Cảm 50g, 62.000 ₫, 18%, 76.000 ₫, 
Nivea, Sữa Dưỡng Thể Nivea Phục Hồi & Chống Nắng Ban Ngày 350ml, 126.000 ₫, 18%, 154.000 ₫, 
Cléo, Lotion Tẩy Lông Cléo Dạng Sữa Cho Mọi Loại Da 90ml, 84.000 ₫, 21%, 106.000 ₫, 
Lifebuoy, Sữa Tắm Lifebuoy Detox Dầu Tràm Trà & Muối Hồng 800g, 155.000 ₫, 21%, 195.000 ₫, 
Curél, Sữa Chống Nắng Curél Mặt & Toàn Thân Cho Da Khô Nhạy Cảm 60ml, 365.000 ₫, 28%, 508.000 ₫, 
CeraVe, Sữa Dưỡng Thể CeraVe Cho Da Thường Đến Khô 236ml, 305.000 ₫, 9%, 335.000 ₫, 
Re:p, Kem Giảm Rạn Da Re:p Làm Săn Chắc Và Mờ Sẹo 200ml, 470.000 ₫, 38%, 760.000 ₫, 
Paula's Choice, Kem Dưỡng Thể Paula's Choice Giảm Viêm Lỗ Chân Lông 60ml, 278.000 ₫, 20%, 349.000 ₫, 
Nerman, Dung Dịch Vệ Sinh Nam Giới Nerman - Sanda Perfume 100ml, 104.000 ₫, 5%, 109.000 ₫, 
Caryophy, Kem Dưỡng Caryophy Sáng Da, 419.000 ₫, 32%, 620.000 ₫, 
Halio, Máy Triệt Lông Cá Nhân Halio IPL Hair Removal Device, 2.499.000 ₫, 22%, 3.200.000 ₫, 
Lifebuoy, Sữa Tắm Lifebuoy Detox Than Hoạt Tính & Cám Gạo 800g, 163.000 ₫, 16%, 195.000 ₫, 
Eucerin, Sữa Dưỡng Thể Eucerin Làm Sáng Da SPF 7 250ml, 288.000 ₫, 22%, 370.000 ₫, 
On: The Body, Sữa Tắm On: The Body Dưỡng Ẩm Hương Tinh Tế 500g, 104.000 ₫, 31%, 150.000 ₫, 
Cetaphil, Sữa Dưỡng Ẩm Cetaphil Dịu Lành Cho Bé Tinh Chất Hoa Cúc 400ml, 268.000 ₫, 20%, 336.000 ₫, 
Deonatulle, Lăn Khử Mùi Deonatulle Đá Khoáng Trắng Không Màu 20g, 236.000 ₫, 21%, 298.000 ₫, 
St.Ives, Sữa Tắm St.Ives Tẩy Tế Bào Chết Hương Muối Biển 650ml, 177.000 ₫, 2%, 180.000 ₫, 
On: The Body, Sữa Tắm On: The Body Dưỡng Ẩm Hương Sang Trọng 500g, 104.000 ₫, 31%, 150.000 ₫, 
Hatomugi, Sữa Tắm Hatomugi Dưỡng Ẩm Sâu, 96.000 ₫, 52%, 199.000 ₫, 
BareSoul, Muối Tắm BareSoul Tẩy Tế Bào Chết Cho Da Đầu & Cơ Thể 330g, 195.000 ₫, 22%, 250.000 ₫, 
Cocoon, Bơ Dưỡng Thể Cocoon Chiết Xuất Cà Phê Đắk Lắk 200ml, 192.000 ₫, 11%, 215.000 ₫, 
Felina, Muối Tắm Tẩy Tế Bào Chết Felina Chiết Xuất Bơ 500g, 79.000 ₫, 44%, 140.000 ₫, 
KAI, Dao Cạo Vùng Bikini KAI (Vỉ 2 Cây), 36.000 ₫, 8%, 39.000 ₫, 
A Bonne, Muối Tắm A Bonne Sữa Chua Làm Sáng & Mềm Mịn Da 350g, 18.000 ₫, 67%, 55.000 ₫, 
Purité By Prôvence, Sữa Tắm Purité Sáng Mịn Da Hương Hoa Anh Đào 1100ml, 232.000 ₫, 19%, 287.000 ₫, 
EtiaXil, Lăn Khử Mùi EtiaXil Hàng Ngày Cho Mọi Loại Da 50ml, 209.000 ₫, 16%, 249.000 ₫, 
Bioderma, Kem Dưỡng Ẩm Bioderma Cho Da Khô Nhạy Cảm 200ml, 293.000 ₫, 10%, 325.000 ₫, 
SVR, Gel Rửa Mặt SVR Không Xà Phòng Cho Da Khô, 271.000 ₫, 15%, 320.000 ₫, 
Nerman, Dung Dịch Vệ Sinh Nam Giới Nerman - Sauvage Perfume 100ml, 99.000 ₫, 9%, 109.000 ₫, 
Tesori d'Oriente, Sữa Tắm Nước Hoa Tesori d'Oriente Hương Hoa Sen 250ml, 137.000 ₫, 22%, 175.000 ₫, 
Dove, Xịt Khử Mùi Dove Dưỡng Da Sáng Mịn Hương Dịu Nhẹ 150ml, 94.000 ₫, 25%, 125.000 ₫, 
On: The Body, Sữa Tắm On: The Body Dưỡng Ẩm Hương Quyến Rũ 1000g, 189.000 ₫, 26%, 255.000 ₫, 
St.Ives, Sữa Dưỡng Thể St.Ives Yến Mạch & Bơ Dưỡng Ẩm Dịu Da 621ml, 171.000 ₫, 11%, 192.000 ₫, 
Hatomugi, Sữa Tắm Hatomugi Dưỡng Ẩm, 80.000 ₫, 65%, 230.000 ₫, 
Dove, Smoothie Tẩy Da Chết Dove Hương Lựu Đỏ 298g, 149.000 ₫, 25%, 199.000 ₫, 
Cocoon, Túi Refill Tẩy Da Chết Toàn Thân Cocoon Sạch Da 600ml, 292.000 ₫, 10%, 325.000 ₫, 
Dove, Serum Ngăn Mùi Dove Giúp Da Sáng Mịn Đều Màu 40ml, 65.000 ₫, 33%, 97.000 ₫, 
EtiaXil, Lăn Khử Mùi EtiaXil Nhãn Xanh Cho Da Nhạy Cảm 15ml, 159.000 ₫, 50%, 320.000 ₫, 
Vaseline, Sữa Dưỡng Thể Vaseline Sáng Da Chuyên Sâu Ban Đêm 330ml, 113.000 ₫, 25%, 150.000 ₫, 
Vaseline, Combo 2 Sữa Dưỡng Thể Vaseline Sáng Mịn Da 330ml, 225.000 ₫, 25%, 300.000 ₫, 
Vaseline, Serum Dưỡng Thể Vaseline Chống Nắng Sáng Da 300ml (Mới), 136.000 ₫, 33%, 203.000 ₫, 
Cocoon, Tẩy Da Chết Toàn Thân Cocoon Cà Phê Đắk Lắk 200ml, 100.000 ₫, 20%, 125.000 ₫, 
Dove, Smoothie Tẩy Da Chết Dove Hương Hoa Anh Đào 298g, 149.000 ₫, 25%, 199.000 ₫, 
Cocoon, Combo Cocoon Tẩy Da Chết Cho Mặt & Toàn Thân Từ Cà Phê Đắk Lắk (200ml+150ml), 221.000 ₫, 24%, 290.000 ₫, 
Lifebuoy, Sữa Tắm Lifebuoy Detox Matcha & Khổ Qua 800g, 153.000 ₫, 22%, 195.000 ₫, 
Dove, Serum Ngăn Mùi Dove Giúp Mờ Thâm Thu Nhỏ Lỗ Chân Lông 40ml, 65.000 ₫, 33%, 97.000 ₫, 
Vaseline, Sữa Dưỡng Thể Vaseline Gluta-Hya Nâng Tông Tức Thì 300ml, 134.000 ₫, 31%, 195.000 ₫, 
Nivea, Sữa Dưỡng Thể Nivea Sáng Da Ban Đêm Từ 8 Super Food 350ml, 99.000 ₫, 29%, 139.000 ₫, 
Nerman, Combo Lịch Lãm Nerman (Sữa Tắm Gội 3in1 350ml & Dung Dịch Vệ Sinh Nam Sanda 100ml), 298.000 ₫, 3%, 308.000 ₫, 
Nivea, Lăn Khử Mùi Nivea Serum Sáng Mịn Hương Hoa Hồng 40ml, 98.000 ₫, 9%, 108.000 ₫, 
Eucerin, Sữa Dưỡng Thể Eucerin Cho Da Nhạy Cảm 250ml, 219.000 ₫, 5%, 231.000 ₫, 
Bioré, Gel Chống Nắng Bioré Màng Nước Dưỡng Ẩm Da 90ml, 183.000 ₫, 27%, 249.000 ₫, 
Lifebuoy, Sữa Tắm Lifebuoy Detox Thảo Dược & Hoa Sen 800g, 185.000 ₫, 5%, 195.000 ₫, 
Cetaphil, Sữa Tắm Cetaphil Dưỡng Ẩm Dịu Lành Cho Viêm Da Cơ Địa 295ml, 408.000 ₫, 15%, 480.000 ₫, 
Secret, Gel Khử Mùi Secret Giảm Tiết Mồ Hôi Hương Lavender 73g, 86.000 ₫, 31%, 125.000 ₫, 
Double Rich, Sữa Tắm Double Rich Dreamy Romance Hương Hoa Iris 550g, 98.000 ₫, 15%, 115.000 ₫, 
Hatomugi, Kem Chống Nắng Hatomugi Dưỡng Ẩm & Làm Sáng Da 80g, 114.000 ₫, 43%, 199.000 ₫, 
Bioderma, Dầu Tắm Bioderma Làm Sạch & Làm Dịu Da Khô, 472.000 ₫, 10%, 525.000 ₫, 
Vaseline, Sữa Dưỡng Thể Vaseline Dưỡng Sáng Da 5% Niacinamide 250ml, 230.000 ₫, 15%, 270.000 ₫, 
Secret, Gel Khử Mùi Secret Giảm Tiết Mồ Hôi Completely Clean 73g, 99.000 ₫, 21%, 125.000 ₫, 
VACOSI, Bông Tắm Vacosi BP21, 33.000 ₫, 17%, 40.000 ₫, 
Vaseline, Combo 2 Sữa Dưỡng Thể Vaseline Chống Nắng & Sáng Da 350mlx2, 207.000 ₫, 28%, 286.000 ₫, 
Dove, Sữa Tắm Dưỡng Thể Dove Da Ẩm Mịn Lưu Hương Ngọt Ngào 500g, 117.000 ₫, 18%, 142.500 ₫, 
Deonatulle, Lăn Khử Mùi Deonatulle Đá Khoáng Xanh Sáng Da 20g, 244.000 ₫, 21%, 310.000 ₫, 
CeraVe, Combo CeraVe Sữa Rửa Mặt Cho Da Dầu 473ml + Sữa Dưỡng Thể Cho Da Khô 20ml, 379.000 ₫, 10%, 421.000 ₫, 
Enchanteur, Sữa Tắm Enchanteur Nước Hoa Dưỡng Da Charming 650g, 145.000 ₫, 22%, 187.000 ₫, 
St.Ives, Sữa Dưỡng Thể St.Ives Vitamin E & Bơ Dưỡng Ẩm Da 621ml, 171.000 ₫, 11%, 192.000 ₫, 
Old Spice, Gel Tắm Old Spice Hương Timber Sảng Khoái Và Tự Tin 473ml, 113.000 ₫, 30%, 161.000 ₫, 
Purité By Prôvence, Sữa Tắm Purité Sáng Mịn Da Hương Hoa Anh Đào 250ml, 68.000 ₫, 12%, 77.000 ₫, 
Derladie, Xà Phòng Derladie Làm Sạch Và Giảm Mụn Cơ Thể 50g, 99.000 ₫, 17%, 120.000 ₫, 
Lactacyd, Sữa Tắm Gội Trẻ Em Lactacyd Milky Bảo Vệ Da & Tóc Bé 500ml, 160.000 ₫, 3%, 165.000 ₫, 
Vaseline, Combo Vaseline Sữa Dưỡng Thể Gluta-Hya Nâng Tông Tức Thì 300mlx2, 285.000 ₫, 27%, 390.000 ₫, 
Cocoon, Gel Tắm Bí Đao Cocoon Làm Giảm Mụn Lưng 310ml, 220.000 ₫, 10%, 245.000 ₫, 
A-Derma, Gel Rửa Mặt & Tắm Gội A-Derma Dịu Nhẹ Cho Da 200ml, 346.000 ₫, 15%, 408.000 ₫, 
La Roche-Posay, Sữa Tắm & Rửa Mặt La Roche-Posay Cho Da Khô Nhạy Cảm 200ml, 397.000 ₫, 18%, 485.000 ₫, 
Nivea, Lăn Khử Mùi Nivea Serum Sáng Mịn Hương Hoa Sakura 40ml, 97.000 ₫, 10%, 108.000 ₫, 
White Conc, Sữa Tắm Sáng Da WHITE CONC 360ml, 213.000 ₫, 39%, 350.000 ₫, 
St.Ives, Sữa Tắm St.Ives Tẩy Tế Bào Chết Hương Cam Chanh 650ml, 178.000 ₫, 1%, 180.000 ₫, 
Tesori d'Oriente, Kem Dưỡng Thể Tesori d'Oriente Hương Hoa Sen 300g, 217.000 ₫, 22%, 279.000 ₫, 
Bioré, Serum Chống Nắng Dưỡng Thể Bioré Dưỡng Ẩm Vượt Trội 150ml, 157.000 ₫, 27%, 216.000 ₫, 
Double Rich, Sữa Tắm Double Rich Dreamy Romance Hương Hoa Iris 800g, 134.000 ₫, 16%, 159.000 ₫, 
Hatomugi, Sữa Dưỡng Thể Hatomugi Chống Nắng Dưỡng Ẩm SPF31 PA+++ 250ml, 110.000 ₫, 55%, 245.000 ₫, 
Dove, Lăn Ngăn Mùi Dove Tinh Chất Serum Thu Nhỏ Lỗ Chân Lông 45ml, 66.000 ₫, 32%, 97.000 ₫, 
Vaseline, Combo Serum Dưỡng Thể Vaseline Chống Nắng Sáng Da 300mlx2, 294.000 ₫, 28%, 406.000 ₫, 
Bioderma, Kem Dưỡng Ẩm Bioderma Chuyên Sâu Cho Da Rất Khô 75ml, 239.000 ₫, 10%, 265.000 ₫, 
La Roche-Posay, [Mini] Gel Rửa Mặt La Roche-Posay Giảm Mụn Cho Mặt, 79.000 ₫, 55%, 175.000 ₫, 
Avène, Kem Chống Nắng Avène Cho Da Thường, 707.000 ₫, 9%, 777.000 ₫, 
Gillette, Dao Cạo Cho Nữ Gilette Venus Hoa Trà Trắng (1 Cán + 2 Lưỡi), 188.000 ₫, 20%, 236.000 ₫, 
Hatomugi, Sữa Tắm Hatomugi Dưỡng Ẩm, 80.000 ₫, 65%, 230.000 ₫, 
Dove, Smoothie Tẩy Da Chết Dove Hương Lựu Đỏ 298g, 149.000 ₫, 25%, 199.000 ₫, 
Cocoon, Túi Refill Tẩy Da Chết Toàn Thân Cocoon Sạch Da 600ml, 292.000 ₫, 10%, 325.000 ₫, 
Dove, Serum Ngăn Mùi Dove Giúp Da Sáng Mịn Đều Màu 40ml, 65.000 ₫, 33%, 97.000 ₫, 
EtiaXil, Lăn Khử Mùi EtiaXil Nhãn Xanh Cho Da Nhạy Cảm 15ml, 159.000 ₫, 50%, 320.000 ₫, 
Vaseline, Sữa Dưỡng Thể Vaseline Sáng Da Chuyên Sâu Ban Đêm 330ml, 113.000 ₫, 25%, 150.000 ₫, 
Vaseline, Combo 2 Sữa Dưỡng Thể Vaseline Sáng Mịn Da 330ml, 225.000 ₫, 25%, 300.000 ₫, 
Vaseline, Serum Dưỡng Thể Vaseline Chống Nắng Sáng Da 300ml (Mới), 136.000 ₫, 33%, 203.000 ₫, 
Cocoon, Tẩy Da Chết Toàn Thân Cocoon Cà Phê Đắk Lắk 200ml, 100.000 ₫, 20%, 125.000 ₫, 
Dove, Smoothie Tẩy Da Chết Dove Hương Hoa Anh Đào 298g, 149.000 ₫, 25%, 199.000 ₫, 
Cocoon, Combo Cocoon Tẩy Da Chết Cho Mặt & Toàn Thân Từ Cà Phê Đắk Lắk (200ml+150ml), 221.000 ₫, 24%, 290.000 ₫, 
Lifebuoy, Sữa Tắm Lifebuoy Detox Matcha & Khổ Qua 800g, 153.000 ₫, 22%, 195.000 ₫, 
Dove, Serum Ngăn Mùi Dove Giúp Mờ Thâm Thu Nhỏ Lỗ Chân Lông 40ml, 65.000 ₫, 33%, 97.000 ₫, 
Vaseline, Sữa Dưỡng Thể Vaseline Gluta-Hya Nâng Tông Tức Thì 300ml, 134.000 ₫, 31%, 195.000 ₫, 
Nivea, Sữa Dưỡng Thể Nivea Sáng Da Ban Đêm Từ 8 Super Food 350ml, 99.000 ₫, 29%, 139.000 ₫, 
Avatar, Sữa Tắm Avatar Thơm Mịn Da Jojoba Bông Hoa 900ml, 158.000 ₫, 16%, 189.000 ₫, 
Vaseline, Combo 2 Sữa Dưỡng Thể Vaseline Ngăn Ngừa Lão Hoá 350mlx2, 204.000 ₫, 29%, 286.000 ₫, 
Senka, Sữa Tắm Dưỡng Ẩm Senka Hương Hoa Dịu Ngọt 500ml, 109.000 ₫, 45%, 198.000 ₫, 
Bioré, Serum Chống Nắng Dưỡng Thể Bioré Sáng Mịn Mát Lạnh 50ml, 64.000 ₫, 19%, 79.000 ₫, 
Milaganics, Dầu Dừa Milaganics Ép Lạnh Tinh Khiết 100ml, 46.000 ₫, 61%, 117.000 ₫, 
Eucerin, Sữa Tắm Eucerin Dịu Nhẹ Cho Da Nhạy Cảm 400ml, 239.000 ₫, 10%, 265.000 ₫, 
Vaseline, Combo 2 Sữa Dưỡng Thể Vaseline Dịu Mát Sáng Da 350mlx2, 269.000 ₫, 5%, 282.000 ₫, 
Old Spice, Sáp Khử Mùi Old Spice Hương Original Truyền Thống 85g, 98.000 ₫, 25%, 130.000 ₫, 
Rexona, Lăn Khử Mùi Cho Nam Rexona Khô Thoáng Antibac 45ml, 51.000 ₫, 18%, 62.000 ₫, 
Nivea, Lăn Khử Mùi Nivea Sáng Mịn Se Khít Lỗ Chân Lông 50ml, 80.000 ₫, 13%, 92.000 ₫, 
Gennie, Combo Gennie Nước Hoa + Sữa Tắm Little Red Dress 50ml + 450ml, 189.000 ₫, 50%, 378.000 ₫, 
JMsolution, Xịt Chống Nắng Toàn Thân JMsolution Từ Hoa Hồng 180ml, 125.000 ₫, 58%, 300.000 ₫, 
Lifebuoy, Sữa Tắm Lifebuoy Bảo Vệ Khỏi Vi Khuẩn Dạng Túi 800g, 127.000 ₫, 16%, 152.000 ₫, 
Bio-Oil, Dầu Chăm Sóc Da Bio-Oil Làm Giảm Rạn Da, 92.000 ₫, 6%, 98.000 ₫, 
Coast, Sữa Tắm Gội Coast Dành Cho Nam 946ml, 167.000 ₫, 9%, 183.000 ₫, 
PUREDERM, Gel Tẩy Tế Bào Chết Purederm Tái Tạo Da 50ml, 36.000 ₫, 28%, 50.000 ₫, 
Lifebuoy, Sữa Tắm Lifebuoy Chăm Sóc Da Dạng Túi 800g, 127.000 ₫, 16%, 152.000 ₫, 
Purité By Prôvence, Sữa Tắm Purité Sáng Mịn Da Hương Hoa Anh Đào 850ml, 163.000 ₫, 33%, 245.000 ₫, 
Refre, Xịt Khử Mùi Refre x Hello Kitty Whitening Perfume Hương Sang Trọng 30ml, 46.000 ₫, 22%, 59.000 ₫, 
Pelican, Xà Phòng Pelican Giảm Thâm Vùng Da Dưới Cánh Tay 100g, 99.000 ₫, 48%, 189.000 ₫, 
Cetaphil, Sữa Dưỡng Ẩm Cetaphil Dịu Lành Cho Da Nhạy Cảm 200ml, 315.000 ₫, 5%, 330.000 ₫, 
Dove, Sữa Tắm Dưỡng Thể Dove Dưỡng Ẩm Chuyên Sâu 500g, 111.000 ₫, 22%, 142.500 ₫, 
On: The Body, Sữa Tắm On: The Body Dưỡng Ẩm Hương Quyến Rũ 500g, 109.000 ₫, 27%, 150.000 ₫, 
Nuxe, Dầu Khô Đa Năng Nuxe Dưỡng Ẩm Cho Da Mặt, 562.000 ₫, 25%, 745.000 ₫, 
Gillette, Gel Khử Mùi Gillette Giảm Tiết Mồ Hôi Hương Cool Wave 107g, 104.000 ₫, 21%, 131.000 ₫, 
BareSoul, Serum Nách BareSoul Che Khuyết Điểm, 227.000 ₫, 19%, 280.000 ₫, 
