Lifebuoy, Sữa Tắm Lifebuoy Detox Matcha & Khổ Qua 800g, 153.000 ₫, 22%, 195.000 ₫, 
Dove, Serum Ngăn Mùi Dove Giúp Mờ Thâm Thu Nhỏ Lỗ Chân Lông 40ml, 65.000 ₫, 33%, 97.000 ₫, 
Vaseline, Sữa Dưỡng Thể Vaseline Gluta-Hya Nâng Tông Tức Thì 300ml, 134.000 ₫, 31%, 195.000 ₫, 
Nivea, Sữa Dưỡng Thể Nivea Sáng Da Ban Đêm Từ 8 Super Food 350ml, 99.000 ₫, 29%, 139.000 ₫, 
Bioré, Combo 2 Serum Chống Nắng Dưỡng Thể Bioré Sáng Mịn Mát Lạnh 150ml, 336.000 ₫, 22%, 432.000 ₫, 
Byphasse, Kem Tẩy Lông Byphasse Chiết Xuất Lô Hội 125ml, 105.000 ₫, 45%, 190.000 ₫, 
Loli & The Wolf, Dung Dịch Vệ Sinh Nam Giới Loli And The Wolf Bạc Hà 80ml, 82.000 ₫, 17%, 99.000 ₫, 
Enchanteur, Sữa Tắm Enchanteur Nước Hoa Dưỡng Da Romantic 650g, 145.000 ₫, 22%, 187.000 ₫, 
Enchanteur, Sữa Tắm Enchanteur Dưỡng Da Thiên Nhiên Lavender 510g, 134.000 ₫, 14%, 156.000 ₫, 
Naris Cosmetics, Xịt Chống Nắng Naris Cosmetics Dưỡng Sáng Da 50g, 295.000 ₫, not available, not available, 
Nivea, Xịt Khử Mùi Nivea Men Mát Lạnh Thơm Năng Động 150ml, 89.000 ₫, 23%, 115.000 ₫, 
Refre, Lăn Khử Mùi Refre Natural Hương Trà Xanh 40ml, 50.000 ₫, 19%, 62.000 ₫, 
Senka, Sữa Tắm Dưỡng Ẩm Senka Hương Hoa Hồng & Hoa Nhài 500ml, 142.000 ₫, 16%, 169.000 ₫, 
Vaseline, Sữa Dưỡng Thể Vaseline Nâng Tông Sáng Da Tức Thì 200ml, 78.000 ₫, 15%, 92.000 ₫, 
Dove, Combo Dove Sữa Tắm Dưỡng Thể 500g + Smoothie Tẩy Da Chết Hương Hoa Anh Đào 298g, 304.000 ₫, 11%, 342.000 ₫, 
Tsubaki, Combo Dầu Gội Tsubaki Ngăn Rụng Tóc 490ml + Sữa Tắm Senka Hoa Tươi Mát 500ml, 307.000 ₫, 26%, 413.000 ₫, 
Nivea, Lăn Khử Mùi Nivea Comfort Khô Thoáng Cho Nữ 50ml, 62.000 ₫, 22%, 79.000 ₫, 
Bio-Oil, Combo Dầu Chăm Sóc Da Bio-Oil 125ml + 25ml, 359.000 ₫, 15%, 420.000 ₫, 
Dove, Sữa Tắm Dưỡng Thể Dove Chăm Sóc & Làm Dịu Da Nhạy Cảm 500g, 112.000 ₫, 21%, 142.500 ₫, 
VACOSI, Kem Dưỡng Vacosi Làm Sáng Vùng Da Dưới Cánh Tay 30ml, 128.000 ₫, 22%, 165.000 ₫, 
Nerman, Combo Nerman Sữa Tắm Gội 350ml + Gel Rửa Mặt 100ml + Dung Dịch Vệ Sinh Nam 100ml, 457.000 ₫, 2%, 467.000 ₫, 
Romano, Xịt Khử Mùi Romano Hương Nước Hoa Gentleman 150ml, 77.000 ₫, 23%, 100.000 ₫, 
Nivea, Lăn Khử Mùi Nivea Serum Dưỡng Da Sáng Mịn 40ml, 68.000 ₫, 26%, 92.000 ₫, 
Naris Cosmetics, Xịt Chống Nắng Naris Cosmetics Nâng Tông Da 80g, 371.000 ₫, 25%, 495.000 ₫, 
Emmié by Happy Skin, Kem Dưỡng Emmié Làm Sáng Cho Da Mặt & Cơ Thể 250ml, 277.000 ₫, 21%, 350.000 ₫, 
Milaganics, Dầu Dừa Milaganics Tinh Khiết Vitamin E 100ml, 46.000 ₫, 61%, 117.000 ₫, 
Happy Event, Dưỡng Chất Giảm Rạn Da Happy Event Tăng Độ Đàn Hồi 40g + Tặng Khăn Tắm Sợi Tre, 443.000 ₫, 11%, 495.000 ₫, 
Organic Shop, Kem Dưỡng Tay & Móng Organic Shop Trái Anh Đào, 90.000 ₫, 35%, 139.000 ₫, 
Tesori d'Oriente, Sữa Tắm Nước Hoa Tesori d'Oriente Hy Lạp Cổ Đại 250ml, 148.000 ₫, 15%, 175.000 ₫, 
Hazeline, Sữa Tắm Hazeline Sáng Mịn Phục Hồi Sữa Ong Chúa & Hoa Ly 800g, 82.000 ₫, 16%, 98.000 ₫, 
Double Rich, Sữa Tắm Double Rich Glowing Lotus Hương Hoa Sen 800g, 158.000 ₫, 1%, 159.000 ₫, 
Purité By Prôvence, Sữa Tắm Purité Dưỡng Da Mềm Mịn Hương Hoa Hồng 850ml, 184.000 ₫, 25%, 245.000 ₫, 
Nivea, Sáp Khử Mùi Nivea Ngọc Trai Đẹp Quyến Rũ 50ml, 73.000 ₫, 26%, 99.000 ₫, 
EtiaXil, Xịt Khử Mùi EtiaXil Dạng Phun Sương 48H Màu Cam 150ml, 209.000 ₫, 16%, 249.000 ₫, 
Paula's Choice, Serum Dưỡng Thể Paula's Choice Làm Sáng & Phục Hồi Da 118ml, 823.000 ₫, 16%, 980.000 ₫, 
Nuxe, Combo Dầu Khô Đa Năng Nuxe Huile Classic 100ml & Hương Hoa Florale 10ml, 820.000 ₫, 15%, 965.000 ₫, 
HASI, Kem Dưỡng Tay Hasi Thảo Mộc Cấp Ẩm & Phục Hồi Móng 80g, 48.000 ₫, 20%, 60.000 ₫, 
Nivea, Lăn Khử Mùi Nivea Men Mát Lạnh Thơm Sảng Khoái 50ml, 60.000 ₫, 30%, 86.000 ₫, 
Gennie, Sữa Tắm Nước Hoa Nữ Gennie Lôi Cuốn & Khí Chất 450ml, 104.000 ₫, 35%, 159.000 ₫, 
Deou, Lăn Khử Mùi Rohto Deou Dành Cho Nam Giới 50ml (Mới), 178.000 ₫, 1%, 180.000 ₫, 
Avatar, Sữa Tắm Avatar Thơm Mịn Da Jojoba Bông Hoa 350ml, 80.000 ₫, 14%, 93.000 ₫, 
Old Spice, Gel Tắm Old Spice Hương Năng Động Và Thành Công 532ml, 121.000 ₫, 20%, 152.000 ₫, 
Refre, Lăn Khử Mùi Refre Whitening Perfume Hương Tình Yêu 40ml, 51.000 ₫, 14%, 59.000 ₫, 
X-Men For Boss, Xịt Khử Mùi X-Men For Boss Intense Hương Trầm Nội Lực 150ml, 93.000 ₫, 21%, 117.000 ₫, 
Hatomugi, Sữa Tắm Hatomugi Dưỡng Ẩm, 80.000 ₫, 65%, 230.000 ₫, 
Dove, Smoothie Tẩy Da Chết Dove Hương Lựu Đỏ 298g, 149.000 ₫, 25%, 199.000 ₫, 
Cocoon, Túi Refill Tẩy Da Chết Toàn Thân Cocoon Sạch Da 600ml, 292.000 ₫, 10%, 325.000 ₫, 
Dove, Serum Ngăn Mùi Dove Giúp Da Sáng Mịn Đều Màu 40ml, 65.000 ₫, 33%, 97.000 ₫, 
EtiaXil, Lăn Khử Mùi EtiaXil Nhãn Xanh Cho Da Nhạy Cảm 15ml, 159.000 ₫, 50%, 320.000 ₫, 
Vaseline, Sữa Dưỡng Thể Vaseline Sáng Da Chuyên Sâu Ban Đêm 330ml, 113.000 ₫, 25%, 150.000 ₫, 
Vaseline, Combo 2 Sữa Dưỡng Thể Vaseline Sáng Mịn Da 330ml, 225.000 ₫, 25%, 300.000 ₫, 
Vaseline, Serum Dưỡng Thể Vaseline Chống Nắng Sáng Da 300ml (Mới), 136.000 ₫, 33%, 203.000 ₫, 
Cocoon, Tẩy Da Chết Toàn Thân Cocoon Cà Phê Đắk Lắk 200ml, 100.000 ₫, 20%, 125.000 ₫, 
Dove, Smoothie Tẩy Da Chết Dove Hương Hoa Anh Đào 298g, 149.000 ₫, 25%, 199.000 ₫, 
Cocoon, Combo Cocoon Tẩy Da Chết Cho Mặt & Toàn Thân Từ Cà Phê Đắk Lắk (200ml+150ml), 221.000 ₫, 24%, 290.000 ₫, 
Lifebuoy, Sữa Tắm Lifebuoy Detox Matcha & Khổ Qua 800g, 153.000 ₫, 22%, 195.000 ₫, 
Dove, Serum Ngăn Mùi Dove Giúp Mờ Thâm Thu Nhỏ Lỗ Chân Lông 40ml, 65.000 ₫, 33%, 97.000 ₫, 
Vaseline, Sữa Dưỡng Thể Vaseline Gluta-Hya Nâng Tông Tức Thì 300ml, 134.000 ₫, 31%, 195.000 ₫, 
Nivea, Sữa Dưỡng Thể Nivea Sáng Da Ban Đêm Từ 8 Super Food 350ml, 99.000 ₫, 29%, 139.000 ₫, 
Olay, Sữa Tắm Olay Tươi Mát Dài Lâu Với Hoa Lan & Quả Lý 650ml, 163.000 ₫, 14%, 190.000 ₫, 
Romano, Xịt Khử Mùi Romano Hương Nước Hoa Attitude 150ml, 82.000 ₫, 18%, 100.000 ₫, 
Curél, Sữa Dưỡng Toàn Thân Curél Cấp Ẩm Chuyên Sâu 220ml, 264.000 ₫, 40%, 441.000 ₫, 
On: The Body, Sữa Tắm Hạt On: The Body Hương Hoa Hồng Pháp 600g, 239.000 ₫, 27%, 328.000 ₫, 
Nivea, Sữa Dưỡng Thể Nivea Dưỡng Sáng Da Vitamin C & A 180ml, 89.000 ₫, 31%, 129.000 ₫, 
Cocoon, Combo Cocoon Gel Tắm Bí Đao 310ml + Tẩy Da Chết Toàn Thân Cà Phê Đắk Lắk 200ml, 306.000 ₫, 15%, 360.000 ₫, 
Dove, Combo Dove Sữa Tắm Dưỡng Thể Hương Anh Đào 500g + Smoothie Tẩy Da Chết Hương Lựu Đỏ 298g, 304.000 ₫, 11%, 342.000 ₫, 
Anessa, Combo Chống Nắng Anessa Dịu Nhẹ Cho Da Nhạy Cảm & Trẻ Em (Dạng Sữa 60ml + Gel 90g), 759.000 ₫, 39%, 1.235.000 ₫, 
Rexona, Lăn Khử Mùi Rexona Hương Thảo Mộc Thư Giãn Cho Nữ 50ml, 47.000 ₫, 15%, 55.000 ₫, 
Purité By Prôvence, Sữa Tắm Purité Thư Giãn Da Hương Hoa Oải Hương 850ml, 198.000 ₫, 19%, 245.000 ₫, 
X-Men For Boss, Xịt Khử Mùi X-Men For Boss Legend Hương Tinh Tế 150ml, 93.000 ₫, 21%, 117.000 ₫, 
Felina, Tinh Dầu Dưỡng Thể Felina Oliu & Argan 100ml, 118.000 ₫, 28%, 165.000 ₫, 
Frudia, Kem Dưỡng Da Tay Frudia Chiết Xuất Quả Mâm Xôi 30ml, 49.000 ₫, 32%, 72.000 ₫, 
Vaseline, Combo 2 Sữa Dưỡng Thể Vaseline Nâng Tông Sáng Da Tức Thì 350mlx2, 242.000 ₫, 15%, 286.000 ₫, 
Refre, Lăn Khử Mùi Refre Natural Chiết Xuất Hương Thảo 40ml, 50.000 ₫, 19%, 62.000 ₫, 
Rexona, Xịt Khử Mùi Rexona Cho Nữ Shower Clean Mát Lạnh 150ml, 85.000 ₫, 6%, 90.500 ₫, 
Cléo, Kem Tẩy Lông Cleo Chiết Xuất Bơ Công Thức Đột Phá 50g, 76.000 ₫, 12%, 86.000 ₫, 
Enchanteur, Sáp Khử Mùi Enchanteur Sáng Da Charming 40g, 72.000 ₫, 14%, 84.000 ₫, 
Bio-Oil, Sữa Dưỡng Thể Bio-Oil Dưỡng Ẩm Toàn Thân 250ml, 285.000 ₫, 3%, 295.000 ₫, 
Nivea, Sữa Dưỡng Thể Nivea Dưỡng Ẩm Chuyên Sâu 48H 550ml, 183.000 ₫, 3%, 189.000 ₫, 
Felina, Muối Tắm Tẩy Tế Bào Chết Felina Tinh Chất Sữa 500g, 104.000 ₫, 26%, 140.000 ₫, 
X-Men For Boss, Lăn Khử Mùi X-Men For Boss Luxury Sang Trọng Tinh Tế 50ml, 60.000 ₫, 24%, 79.000 ₫, 
Romano, Xịt Khử Mùi Romano Vip Hương Passion 150ml, 93.000 ₫, 21%, 117.000 ₫, 
Hazeline, Sữa Tắm Hazeline Sáng Mịn Dưỡng Ẩm Yến Mạch & Dâu Tằm Túi 900g, 83.000 ₫, 19%, 102.000 ₫, 
Gillette, Dao Cạo Cho Nữ Gillette Venus Smooth 2UP (1 Cán + 2 Lưỡi), 173.000 ₫, 7%, 186.000 ₫, 
Refre, Lăn Khử Mùi Refre Whitening Perfume Hương Sang Trọng 40ml, 48.000 ₫, 19%, 59.000 ₫, 
Gennie, Sữa Tắm Nước Hoa Nữ Gennie Kiêu Kỳ & Dịu Dàng 450ml, 103.000 ₫, 35%, 159.000 ₫, 
Cocoon, Combo Cocoon Làm Sạch Da Chết Và Dưỡng Ẩm Cơ Thể Từ Cà Phê, 304.000 ₫, 20%, 380.000 ₫, 
Malissa Kiss, Sữa Dưỡng Thể Malissa Kiss Sáng Da #Crazy In Love 226g, 141.000 ₫, 25%, 189.000 ₫, 
Vaseline, Sữa Dưỡng Thể Vaseline Sáng Da Chống Nắng Và Ô Nhiễm 200ml, 78.000 ₫, 15%, 92.000 ₫, 
Malissa Kiss, Dưỡng Thể Chống Nắng Malissa Kiss Hương Nước Hoa Delight 200g, 166.000 ₫, 12%, 189.000 ₫, 
Cathy Doll, Sữa Dưỡng Thể Cathy Doll Hương Nước Hoa Bare Heart 150ml, 165.000 ₫, 8%, 179.000 ₫, 
Vaseline, Combo 2 Sữa Dưỡng Thể Vaseline Bảo Vệ Sáng Mịn Ban Ngày 330ml, 239.000 ₫, 20%, 300.000 ₫, 
Refre, Lăn Khử Mùi Refre Whitening Perfume Hương Ngọt Ngào 40ml, 48.000 ₫, 19%, 59.000 ₫, 
Organic Shop, Kem Dưỡng Tay & Móng Organic Shop Ngọc Lan Tây, 118.000 ₫, 15%, 139.000 ₫, 
Nivea, Combo Lăn Khử Mùi Sáng Mịn Mờ Thâm 50ml & Hương Hoa Hồng Hokkaido 40ml, 191.000 ₫, 4%, 200.000 ₫, 
Parisian, Sữa Tắm Parisian Nước Hoa Nữ - Lux For Her 265ml, 71.000 ₫, 35%, 109.000 ₫, 
Purité By Prôvence, Sữa Dưỡng Thể Purité Mềm Mịn Hương Hoa Hồng 250ml, 109.000 ₫, 11%, 123.000 ₫, 
De Memoria, Sữa Tắm D​e M​emoria Sáng Da Hương Rose On Venus 300ml, 325.000 ₫, 41%, 550.000 ₫, 
Felina, Muối Tắm Tẩy Tế Bào Chết Felina Từ Hoa Mẫu Đơn 500g, 104.000 ₫, 26%, 140.000 ₫, 
Hatomugi, Sữa Tắm Hatomugi Dưỡng Ẩm, 80.000 ₫, 65%, 230.000 ₫, 
Dove, Smoothie Tẩy Da Chết Dove Hương Lựu Đỏ 298g, 149.000 ₫, 25%, 199.000 ₫, 
Cocoon, Túi Refill Tẩy Da Chết Toàn Thân Cocoon Sạch Da 600ml, 292.000 ₫, 10%, 325.000 ₫, 
Dove, Serum Ngăn Mùi Dove Giúp Da Sáng Mịn Đều Màu 40ml, 65.000 ₫, 33%, 97.000 ₫, 
EtiaXil, Lăn Khử Mùi EtiaXil Nhãn Xanh Cho Da Nhạy Cảm 15ml, 159.000 ₫, 50%, 320.000 ₫, 
Vaseline, Sữa Dưỡng Thể Vaseline Sáng Da Chuyên Sâu Ban Đêm 330ml, 113.000 ₫, 25%, 150.000 ₫, 
Vaseline, Combo 2 Sữa Dưỡng Thể Vaseline Sáng Mịn Da 330ml, 225.000 ₫, 25%, 300.000 ₫, 
Vaseline, Serum Dưỡng Thể Vaseline Chống Nắng Sáng Da 300ml (Mới), 136.000 ₫, 33%, 203.000 ₫, 
Cocoon, Tẩy Da Chết Toàn Thân Cocoon Cà Phê Đắk Lắk 200ml, 100.000 ₫, 20%, 125.000 ₫, 
Dove, Smoothie Tẩy Da Chết Dove Hương Hoa Anh Đào 298g, 149.000 ₫, 25%, 199.000 ₫, 
Cocoon, Combo Cocoon Tẩy Da Chết Cho Mặt & Toàn Thân Từ Cà Phê Đắk Lắk (200ml+150ml), 221.000 ₫, 24%, 290.000 ₫, 
Lifebuoy, Sữa Tắm Lifebuoy Detox Matcha & Khổ Qua 800g, 153.000 ₫, 22%, 195.000 ₫, 
Dove, Serum Ngăn Mùi Dove Giúp Mờ Thâm Thu Nhỏ Lỗ Chân Lông 40ml, 65.000 ₫, 33%, 97.000 ₫, 
Vaseline, Sữa Dưỡng Thể Vaseline Gluta-Hya Nâng Tông Tức Thì 300ml, 134.000 ₫, 31%, 195.000 ₫, 
Nivea, Sữa Dưỡng Thể Nivea Sáng Da Ban Đêm Từ 8 Super Food 350ml, 99.000 ₫, 29%, 139.000 ₫, 
Tesori d'Oriente, Sữa Tắm Nước Hoa Tesori d'Oriente Hương Ayurveda 250ml, 148.000 ₫, 15%, 175.000 ₫, 
Purité By Prôvence, Sữa Tắm Purité Dưỡng Da Mềm Mịn Hương Hoa Hồng 250ml, 68.000 ₫, 12%, 77.000 ₫, 
Romano, Tắm Gội 2 Trong 1 Romano Hương Nước Hoa Attitude 650g, 133.000 ₫, 24%, 175.000 ₫, 
Acnes, Xà Phòng Acnes Hỗ Trợ Kháng Khuẩn Và Ngăn Ngừa Mụn 75g, 59.000 ₫, 13%, 68.000 ₫, 
Nivea, Lăn Khử Mùi Nivea Men Khô Thoáng Da Vượt Trội 50ml, 43.000 ₫, 40%, 72.000 ₫, 
Chinoshio, Xà Phòng Chinoshio Dokudami Cho Mặt & Toàn Thân 130g, 47.000 ₫, 20%, 59.000 ₫, 
Romano, Lăn Khử Mùi Romano Hương Nước Hoa Gentleman 50ml, 45.000 ₫, 31%, 65.000 ₫, 
EtiaXil, Lăn Khử Mùi Etiaxil Ngăn Mồ Hôi Chuyên Biệt 50ml, 209.000 ₫, 16%, 249.000 ₫, 
Malissa Kiss, Sữa Dưỡng Thể Malissa Kiss Sáng Da #Lost In Paradise 226g, 188.000 ₫, 1%, 189.000 ₫, 
Eveline, Kem Tẩy Lông Eveline Từ Lô Hội Cho Da Nhạy Cảm 125ml, 119.000 ₫, 30%, 169.000 ₫, 
Vichy, Combo Vichy Lăn Khử Mùi 50ml + Xịt Khoáng Dưỡng Da 50ml, 309.000 ₫, 20%, 387.000 ₫, 
Milaganics, Bột Yến Mạch Milaganics Ngăn Ngừa Lão Hóa & Mụn 100g (Túi), 14.000 ₫, 56%, 32.000 ₫, 
Frudia, Kem Dưỡng Da Tay Frudia Chiết Xuất Bưởi 30ml, 49.000 ₫, 32%, 72.000 ₫, 
Frudia, Kem Dưỡng Da Tay Frudia Chiết Xuất Quả Mọng 30ml, 49.000 ₫, 32%, 72.000 ₫, 
Nivea, Sáp Khử Mùi Nivea Men Cho Nam Mát Lạnh 50ml, 76.000 ₫, 30%, 109.000 ₫, 
Romano, Sữa Tắm Romano Hương Nước Hoa Classic 650g, 136.000 ₫, 22%, 175.000 ₫, 
X-Men For Boss, Lăn Khử Mùi X-Men For Boss Intense Hương Trầm Nội Lực 50ml, 60.000 ₫, 24%, 79.000 ₫, 
Enchanteur, Xịt Khử Mùi Enchanteur Hương Nước Hoa Charming 150ml, 95.000 ₫, 1%, 96.000 ₫, 
Byphasse, Kem Tẩy Lông Byphasse Chiết Xuất Tơ Tằm 125ml, 119.000 ₫, 37%, 190.000 ₫, 
Malissa Kiss, Dưỡng Thể Chống Nắng Malissa Kiss Hương Nước Hoa Hottie 200g, 142.000 ₫, 25%, 189.000 ₫, 
De Memoria, Bộ Sữa Tắm Và Dưỡng Thể De Memoria Hương Rose On Venus 2x300ml, 590.000 ₫, 46%, 1.100.000 ₫, 
australis, Kem Chống Nắng Australis Phổ Rộng Hương Trái Thơm 125ml, 290.000 ₫, 20%, 363.000 ₫, 
Refre, Lăn Khử Mùi Refre Natural Chiết Xuất Hương Gỗ 40ml, 50.000 ₫, 19%, 62.000 ₫, 
Tree Hut, Tẩy Tế Bào Chết Toàn Thân Tree Hut Vitamin C 510g, 382.000 ₫, 13%, 440.000 ₫, 
Romano, Xịt Khử Mùi Romano Hương Nước Hoa Classic 150ml, 86.000 ₫, 14%, 100.000 ₫, 
Organic Shop, Tẩy Da Chết Toàn Thân Organic Shop Hương Mâm Xôi 250ml, 109.000 ₫, 36%, 169.000 ₫, 
Deou, Sữa Tắm Rohto Deou Làm Sạch, 225.000 ₫, 20%, 280.000 ₫, 
Enchanteur, Lăn Khử Mùi Enchanteur Sáng Da Sensation 50ml, 77.000 ₫, 14%, 90.000 ₫, 
Cathy Doll, Sữa Dưỡng Thể Cathy Doll Dưỡng Sáng, 159.000 ₫, not available, not available, 
Enchanteur, Sữa Tắm Enchanteur Dưỡng Da Thiên Nhiên Hoa Hồng 510g, 130.000 ₫, 17%, 156.000 ₫, 
Refre, Lăn Khử Mùi Refre Whitening Perfume Hương Phấn Thơm 40ml, 48.000 ₫, 19%, 59.000 ₫, 
Nivea, Xịt Khử Mùi Nivea Serum Dưỡng Sáng Da Hương Hoa Lily 150ml, 121.000 ₫, 3%, 125.000 ₫, 
Malissa Kiss, Sữa Dưỡng Thể Malissa Kiss Sáng Da #Sweet Poison 226g, 156.000 ₫, 17%, 189.000 ₫, 
Enchanteur, Sáp Khử Mùi Enchanteur Sáng Da Delightful 40g, 72.000 ₫, 14%, 84.000 ₫, 
Nerman, Combo Nerman Dung Dịch Vệ Sinh Nam Sanda Perfume + Xịt Thơm Miệng Cool Smile, 269.000 ₫, 3%, 278.000 ₫, 
St.Ives, Sữa Tắm St.Ives Tẩy Tế Bào Chết Hương Mơ 473ml, 150.000 ₫, not available, not available, 
St.Ives, Sữa Tắm St.Ives Dưỡng Ẩm Da Yến Mạch & Bơ Hạt Mỡ 473ml, 128.000 ₫, 15%, 150.000 ₫, 
Felina, Kem Tắm Tẩy Tế Bào Chết Felina Cà Phê & Tinh Dầu Dừa 400g, 175.000 ₫, 16%, 209.000 ₫, 
Cathy Doll, Kem Chống Nắng Cathy Doll Sáng Da SPF50/PA+++ 138ml, 159.000 ₫, not available, not available, 
Nuxe, [HSD 05/2024] Gel Rửa Mặt & Tắm Toàn Thân Nuxe Cho Da Khô, 250.000 ₫, 60%, 625.000 ₫, 
Hatomugi, Sữa Tắm Hatomugi Dưỡng Ẩm, 80.000 ₫, 65%, 230.000 ₫, 
Dove, Smoothie Tẩy Da Chết Dove Hương Lựu Đỏ 298g, 149.000 ₫, 25%, 199.000 ₫, 
Cocoon, Túi Refill Tẩy Da Chết Toàn Thân Cocoon Sạch Da 600ml, 292.000 ₫, 10%, 325.000 ₫, 
Dove, Serum Ngăn Mùi Dove Giúp Da Sáng Mịn Đều Màu 40ml, 65.000 ₫, 33%, 97.000 ₫, 
EtiaXil, Lăn Khử Mùi EtiaXil Nhãn Xanh Cho Da Nhạy Cảm 15ml, 159.000 ₫, 50%, 320.000 ₫, 
Vaseline, Sữa Dưỡng Thể Vaseline Sáng Da Chuyên Sâu Ban Đêm 330ml, 113.000 ₫, 25%, 150.000 ₫, 
Vaseline, Combo 2 Sữa Dưỡng Thể Vaseline Sáng Mịn Da 330ml, 225.000 ₫, 25%, 300.000 ₫, 
Vaseline, Serum Dưỡng Thể Vaseline Chống Nắng Sáng Da 300ml (Mới), 136.000 ₫, 33%, 203.000 ₫, 
Cocoon, Tẩy Da Chết Toàn Thân Cocoon Cà Phê Đắk Lắk 200ml, 100.000 ₫, 20%, 125.000 ₫, 
Dove, Smoothie Tẩy Da Chết Dove Hương Hoa Anh Đào 298g, 149.000 ₫, 25%, 199.000 ₫, 
Cocoon, Combo Cocoon Tẩy Da Chết Cho Mặt & Toàn Thân Từ Cà Phê Đắk Lắk (200ml+150ml), 221.000 ₫, 24%, 290.000 ₫, 
Lifebuoy, Sữa Tắm Lifebuoy Detox Matcha & Khổ Qua 800g, 153.000 ₫, 22%, 195.000 ₫, 
Dove, Serum Ngăn Mùi Dove Giúp Mờ Thâm Thu Nhỏ Lỗ Chân Lông 40ml, 65.000 ₫, 33%, 97.000 ₫, 
Vaseline, Sữa Dưỡng Thể Vaseline Gluta-Hya Nâng Tông Tức Thì 300ml, 134.000 ₫, 31%, 195.000 ₫, 
Nivea, Sữa Dưỡng Thể Nivea Sáng Da Ban Đêm Từ 8 Super Food 350ml, 99.000 ₫, 29%, 139.000 ₫, 
Purité By Prôvence, Sữa Tắm Purité Dưỡng Da Mềm Mịn Hương Hoa Linh Lan 850ml, 202.000 ₫, 18%, 245.000 ₫, 
X-Men For Boss, Sữa Tắm X-Men For Boss Intense Hương Trầm Nội Lực 650g, 166.000 ₫, 22%, 213.000 ₫, 
Olay, Sữa Tắm Olay Dưỡng Ẩm Da Với Sữa Hạnh Nhân 650ml, 139.000 ₫, 27%, 190.000 ₫, 
Dove, Combo Dove Sữa Tắm Dưỡng Thể Hương Vanilla 500g + Smoothie Tẩy Da Chết Hương Dừa 298g, 338.000 ₫, 14%, 392.000 ₫, 
Naris Cosmetics, Sữa Tắm Naris Dưỡng Ẩm Da Hương Cam Quýt 550ml, 475.000 ₫, 20%, 595.000 ₫, 
Malissa Kiss, Sữa Dưỡng Thể Malissa Kiss Sáng Da #Call Me Maybe 226g, 188.000 ₫, 1%, 189.000 ₫, 
Enchanteur, Sữa Tắm Enchanteur Dưỡng Da Thiên Nhiên Hoa Iris 510g, 134.000 ₫, 14%, 156.000 ₫, 
Felina, Kem Tắm Tẩy Tế Bào Chết Felina Cà Phê & Tinh Chất Sữa 400g, 166.000 ₫, 21%, 209.000 ₫, 
Argussy, Muối Tắm Argussy Tẩy Tế Bào Chết Hương Sữa Bò 300g, 32.000 ₫, not available, not available, 
Cathy Doll, Sữa Dưỡng Thể Cathy Doll Hương Nước Hoa White Moon 150ml, 165.000 ₫, 8%, 179.000 ₫, 
Felina, Kem Dưỡng Toàn Thân Felina Sáng Da Từ Tinh Chất Sữa 250g, 247.000 ₫, 1%, 249.000 ₫, 
Bioderma, Dầu Tắm Bioderma Làm Sạch & Làm Dịu Da Khô, 329.000 ₫, 10%, 365.000 ₫, 
Cocoon, Combo 2 Tẩy Da Chết Toàn Thân Cocoon Đường Thốt Nốt An Giang 200ml, 280.000 ₫, 15%, 330.000 ₫, 
Cathy Doll, Sữa Dưỡng Thể Cathy Doll Nước Hoa Merry Go Round 150ml, 179.000 ₫, not available, not available, 
CeraVe, [Mini] Sữa Dưỡng Thể CeraVe Cho Da Khô Đến Rất Khô 20ml, 25.000 ₫, 39%, 41.000 ₫, 
HASI, Kem Dưỡng Tay Hasi Thảo Mộc Dưỡng Sáng Da Tay & Móng 80g, 48.000 ₫, 20%, 60.000 ₫, 
Vaseline, Sữa Dưỡng Thể Vaseline Dịu Mát Sáng Da 200ml, 79.000 ₫, 19%, 98.000 ₫, 
Tree Hut, Tẩy Tế Bào Chết Toàn Thân Tree Hut Hoa Hồng 510g, 320.000 ₫, 27%, 440.000 ₫, 
Jmella, Sữa Tắm Jmella Hương Cam Quýt Và Mẫu Đơn Sang Trọng 500ml, 119.000 ₫, 30%, 170.000 ₫, 
X-Men, Tắm Gội Nước Hoa X-Men Fire 2in1 Thơm Lâu Sạch Sâu 650g, 158.000 ₫, 18%, 193.000 ₫, 
HASI, Sữa Tắm Hasi Kokeshi Sữa Bò & Ngọc Trai Sáng Mịn Da 600ml, 85.000 ₫, 35%, 130.000 ₫, 
Enchanteur, Lăn Khử Mùi Enchanteur Hương Nước Hoa Charming 50ml, 62.000 ₫, 27%, 84.500 ₫, 
Argussy, Muối Tắm Argussy Tẩy Tế Bào Chết Sáng Da Hương Cam 300g, 32.000 ₫, 14%, 37.000 ₫, 
Romano, Lăn Khử Mùi Romano Hương Nước Hoa Classic 50ml, 56.000 ₫, 14%, 65.000 ₫, 
Cathy Doll, Tẩy Tế Bào Chết Toàn Thân Cathy Doll Sáng Da Sữa Bò 320ml, 129.000 ₫, not available, not available, 
Romano, Xịt Khử Mùi Romano Hương Nước Hoa Force 150ml, 77.000 ₫, 23%, 100.000 ₫, 
CeraVe, Combo CeraVe Sữa Dưỡng Ẩm Ban Đêm 52ml + Sữa Dưỡng Thể Da Khô 20ml, 305.000 ₫, 12%, 346.000 ₫, 
Romano, Lăn Khử Mùi Romano Hương Nước Hoa Attitude 50ml, 49.000 ₫, 25%, 65.000 ₫, 
Refre, Lăn Khử Mùi Refre Natural Hương Hồng Mộc Lan 40ml, 50.000 ₫, 19%, 62.000 ₫, 
Enchanteur, Lăn Khử Mùi Enchanteur Sáng Da Delightful 50ml, 77.000 ₫, 14%, 90.000 ₫, 
Nivea, Sữa Dưỡng Thể Nivea Dưỡng Ẩm Da Chuyên Sâu 400ml, 135.000 ₫, 3%, 139.000 ₫, 
Refre, Lăn Khử Mùi Refre Whitening Perfume Hương Thanh Nhã 40ml, 48.000 ₫, 19%, 59.000 ₫, 
Bioré, Serum Chống Nắng Dưỡng Thể Bioré Dưỡng Ẩm Vượt Trội 50ml, 64.000 ₫, 19%, 79.000 ₫, 
Bioré, Gel Chống Nắng Bioré Màng Nước Dưỡng Ẩm Hương Hoa Mẫu Đơn 90ml, 172.000 ₫, 25%, 230.000 ₫, 
Enchanteur, Xịt Khử Mùi Enchanteur Hương Nước Hoa Delightful 150ml, 95.000 ₫, 1%, 96.000 ₫, 
Tesori d'Oriente, Sữa Tắm Nước Hoa Tesori d'Oriente Hoàng Gia Yemen 250ml, 169.000 ₫, 3%, 175.000 ₫, 
Old Spice, Sáp Khử Mùi Old Spice Hương Pure Sport Năng Động 85g (Trắng), 167.000 ₫, not available, not available, 
Frudia, Kem Dưỡng Da Tay Frudia Chiết Xuất Cam Quýt 30ml, 49.000 ₫, 32%, 72.000 ₫, 
Jmella, Sữa Tắm Jmella Hương Vải Và Huệ Trắng Phương Đông 500ml, 119.000 ₫, 30%, 170.000 ₫, 
Romano, Tắm Gội 2 Trong 1 Romano Hương Nước Hoa Force 650g, 144.000 ₫, 18%, 175.000 ₫, 
Hatomugi, Sữa Tắm Hatomugi Dưỡng Ẩm, 80.000 ₫, 65%, 230.000 ₫, 
Dove, Smoothie Tẩy Da Chết Dove Hương Lựu Đỏ 298g, 149.000 ₫, 25%, 199.000 ₫, 
Cocoon, Túi Refill Tẩy Da Chết Toàn Thân Cocoon Sạch Da 600ml, 292.000 ₫, 10%, 325.000 ₫, 
Dove, Serum Ngăn Mùi Dove Giúp Da Sáng Mịn Đều Màu 40ml, 65.000 ₫, 33%, 97.000 ₫, 
EtiaXil, Lăn Khử Mùi EtiaXil Nhãn Xanh Cho Da Nhạy Cảm 15ml, 159.000 ₫, 50%, 320.000 ₫, 
Vaseline, Sữa Dưỡng Thể Vaseline Sáng Da Chuyên Sâu Ban Đêm 330ml, 113.000 ₫, 25%, 150.000 ₫, 
Vaseline, Combo 2 Sữa Dưỡng Thể Vaseline Sáng Mịn Da 330ml, 225.000 ₫, 25%, 300.000 ₫, 
Vaseline, Serum Dưỡng Thể Vaseline Chống Nắng Sáng Da 300ml (Mới), 136.000 ₫, 33%, 203.000 ₫, 
Cocoon, Tẩy Da Chết Toàn Thân Cocoon Cà Phê Đắk Lắk 200ml, 100.000 ₫, 20%, 125.000 ₫, 
Dove, Smoothie Tẩy Da Chết Dove Hương Hoa Anh Đào 298g, 149.000 ₫, 25%, 199.000 ₫, 
Cocoon, Combo Cocoon Tẩy Da Chết Cho Mặt & Toàn Thân Từ Cà Phê Đắk Lắk (200ml+150ml), 221.000 ₫, 24%, 290.000 ₫, 
Lifebuoy, Sữa Tắm Lifebuoy Detox Matcha & Khổ Qua 800g, 153.000 ₫, 22%, 195.000 ₫, 
Dove, Serum Ngăn Mùi Dove Giúp Mờ Thâm Thu Nhỏ Lỗ Chân Lông 40ml, 65.000 ₫, 33%, 97.000 ₫, 
Vaseline, Sữa Dưỡng Thể Vaseline Gluta-Hya Nâng Tông Tức Thì 300ml, 134.000 ₫, 31%, 195.000 ₫, 
Nivea, Sữa Dưỡng Thể Nivea Sáng Da Ban Đêm Từ 8 Super Food 350ml, 99.000 ₫, 29%, 139.000 ₫, 
Nerman, Combo 2 Sữa Tắm Gội Nerman Hương Nước Hoa Cao Cấp 350ml, 401.000 ₫, 4%, 418.000 ₫, 
Nerman, [Mini] Dung Dịch Vệ Sinh Nam Giới Nerman - Sanda Perfume 30g, 40.000 ₫, not available, not available, 
Nivea, Xịt Khử Mùi Nivea Men Mát Lạnh Thơm Sảng Khoái 150ml, 112.000 ₫, 3%, 115.000 ₫, 
Nivea, Combo 2 Lăn Khử Mùi Nivea Ngọc Trai Dưỡng Da Sáng Mịn 50ml, 176.000 ₫, 4%, 184.000 ₫, 
OXY, Bộ Sản Phẩm OXY Làm Sạch Sâu, 198.000 ₫, 10%, 220.000 ₫, 
X-Men For Boss, Tắm Gội X-Men For Boss Intense 2in1 Hương Trầm Nội Lực 850g, 198.000 ₫, 20%, 248.000 ₫, 
Jmella, Kem Dưỡng Da Tay Jmella Hương Vải Và Huệ Trắng 50ml, 88.000 ₫, 30%, 125.000 ₫, 
Frudia, Kem Dưỡng Da Tay Frudia Chiết Xuất Xoài 30ml, 49.000 ₫, 32%, 72.000 ₫, 
HASI, Sữa Tắm Hasi Kokeshi Nha Đam & Olive Ẩm Mịn Da 600ml, 85.000 ₫, 35%, 130.000 ₫, 
Nerman, Combo Nerman Black Panther Sữa Tắm Gội 2in1 350g + Sữa Rửa Mặt 100g, 379.000 ₫, 7%, 408.000 ₫, 
Malissa Kiss, Sữa Dưỡng Thể Malissa Kiss Sáng Da #Sweet Vanilla 226g, 142.000 ₫, 25%, 189.000 ₫, 
Felina, Gel Tẩy Tế Bào Chết Felina Chiết Xuất Quả Bơ 300ml, 104.000 ₫, 31%, 150.000 ₫, 
Nivea, Xịt Khử Mùi Nivea Men Than Hoạt Tính Hương Rừng 150ml, 98.000 ₫, 22%, 125.000 ₫, 
Curél, Sữa Tắm Toàn Thân Curél Cấp Ẩm Chuyên Sâu 420ml, 247.000 ₫, 27%, 339.000 ₫, 
Bio-Oil, Sữa Dưỡng Thể Bio-Oil Dưỡng Ẩm Toàn Thân 175ml, 180.000 ₫, 25%, 240.000 ₫, 
Enchanteur, Xịt Khử Mùi Enchanteur Hương Nước Hoa Sensation 150ml, 95.000 ₫, 1%, 96.000 ₫, 
Cathy Doll, Sữa Dưỡng Thể Cathy Doll Hương Sweet Dew 150ml, 179.000 ₫, not available, not available, 
