Malissa Kiss, Xịt Thơm Toàn Thân Malissa Kiss Hương Adore You 88ml, 126.000 ₫, 25%, 169.000 ₫, 
Sunsilk, Dầu Xả Sunsilk Mềm Mượt Diệu Kỳ 640g, 134.000 ₫, 5%, 141.000 ₫, 
SVR, Sáp Dưỡng Môi SVR Cho Môi Khô, 149.000 ₫, 10%, 165.000 ₫, 
Vichy, Dưỡng Chất Vichy Giảm Nếp Nhăn Và Giúp Trẻ Hoá Da 30ml, 1.025.000 ₫, 18%, 1.250.000 ₫, 
La Roche-Posay, Sữa Rửa Mặt La Roche-Posay Cho Da Hỗn Hợp Rất Nhạy Cảm 50ml, 205.000 ₫, 18%, 250.000 ₫, 
dProgram, Serum d program Dưỡng Da Bảo Vệ Chuyên Sâu 40ml, 482.000 ₫, 30%, 690.000 ₫, 
Vichy, Combo Vichy Chống Nắng Giảm Thâm Nám & Gel Rửa Mặt Da Dầu, 438.000 ₫, 25%, 585.000 ₫, 
L'Oreal, Nước Tẩy Trang L'Oreal Tươi Mát Cho Da Dầu, 158.000 ₫, 28%, 219.000 ₫, 
Klairs, Nước Hoa Hồng Klairs Không Mùi Cho Da Nhạy Cảm 180ml, 266.000 ₫, 35%, 409.000 ₫, 
La Roche-Posay, Kem Chống Nắng La Roche-Posay Kiểm Soát Dầu SPF50+ 50ml, 396.000 ₫, 26%, 535.000 ₫, 
Skin1004, Kem Chống Nắng Skin1004 Cho Da Nhạy Cảm SPF 50+ 50ml, 276.000 ₫, 35%, 425.000 ₫, 
L'Oreal, Nước Tẩy Trang L'Oreal Làm Sạch Sâu Trang Điểm 400ml, 159.000 ₫, 27%, 219.000 ₫, 
Anessa, Sữa Chống Nắng Anessa Dưỡng Da Kiềm Dầu 60ml, 393.000 ₫, 45%, 715.000 ₫, 
Bioderma, Nước Tẩy Trang Bioderma Dành Cho Da Nhạy Cảm 500ml, 393.000 ₫, 25%, 525.000 ₫, 
CeraVe, Sữa Rửa Mặt CeraVe Sạch Sâu Cho Da Thường Đến Da Dầu 473ml, 389.000 ₫, 12%, 440.000 ₫, 
Bioderma, Nước Tẩy Trang Bioderma Dành Cho Da Dầu & Hỗn Hợp 500ml, 393.000 ₫, 25%, 525.000 ₫, 
Anessa, Sữa Chống Nắng Anessa Cho Da Nhạy Cảm & Trẻ Em 60ml, 393.000 ₫, 45%, 715.000 ₫, 
Cosrx, Gel Rửa Mặt Cosrx Tràm Trà, 118.000 ₫, 65%, 339.000 ₫, 
Hatomugi, Sữa Tắm Hatomugi Dưỡng Ẩm, 80.000 ₫, 65%, 230.000 ₫, 
La Roche-Posay, Nước Tẩy Trang La Roche-Posay Dành Cho Da Nhạy Cảm 400ml, 370.000 ₫, 25%, 495.000 ₫, 
L'Oreal, Nước Tẩy Trang L'Oreal Dưỡng Ẩm Cho Da Thường, 159.000 ₫, 27%, 219.000 ₫, 
La Roche-Posay, Kem Dưỡng La Roche-Posay Giúp Phục Hồi Da Đa Công Dụng 40ml, 310.000 ₫, 21%, 390.000 ₫, 
Listerine, Nước Súc Miệng Listerine Hơi Thở Thơm Mát 750ml, 124.000 ₫, 24%, 163.000 ₫, 
Gillette, Dao Cạo Nữ Gillette Simply Venus Basic 3 Lưỡi (Vỉ 2 Cây), 28.000 ₫, 12%, 32.000 ₫, 
Kiehl's, Sữa Rửa Mặt Kiehl's Hoa Cúc Làm Sạch Sâu Da 75ml, 436.000 ₫, 10%, 485.000 ₫, 
Aura Beauty, Bông Tẩy Trang Aura Beauty 150 Miếng, 28.000 ₫, 35%, 43.000 ₫, 
AXE, Xịt Khử Mùi AXE Cho Nam Hương Nước Hoa Black 135ml, 75.000 ₫, 31%, 108.000 ₫, 
Teana, Serum Teana Dưỡng Ẩm, 435.000 ₫, 24%, 570.000 ₫, 
L'Oreal, Kem Nhuộm L'Oreal Dưỡng Tóc Sâu 5.13 Nâu Ánh Tro 172ml, 169.000 ₫, 15%, 199.000 ₫, 
3CE, Son Thỏi 3CE Vỏ Trong Suốt Eternal Warm - Gạch Caramel 3.5g, 304.000 ₫, 20%, 380.000 ₫, 
Organist, Dầu Gội Organist Hương Thảo & Muối Biển Cho Tóc Dầu 500ml, 117.000 ₫, 31%, 169.000 ₫, 
Teana, Serum Teana Dưỡng Sáng Da, 337.000 ₫, 15%, 395.000 ₫, 
CeraVe, Combo CeraVe Sữa Rửa Mặt Cho Da Khô 473ml + Sữa Dưỡng Thể Cho Da Khô 20ml, 379.000 ₫, 10%, 421.000 ₫, 
The Lab, Kem Dưỡng Ẩm The Lab Dành Cho Da Khô & Nhạy Cảm 50ml, 451.000 ₫, 20%, 565.000 ₫, 
Bioré, Khăn Tẩy Trang Dưỡng Ẩm Bioré 10 Miếng (Hồng), 23.000 ₫, 21%, 29.000 ₫, 
Maybelline, Kem Nền Maybelline 30H Lâu Trôi Che Phủ Cao #128 30ml, 239.000 ₫, 20%, 298.000 ₫, 
St.Ives, Sữa Tắm St.Ives Tươi Mát Hoa Hồng Và Lô Hội 650ml, 178.000 ₫, 1%, 180.000 ₫, 
innisfree, Son Dưỡng innisfree Không Màu Chiết Xuất Mật Ong 3.5g, 159.000 ₫, 1%, 160.000 ₫, 
Some By Mi, Mặt Nạ Some By Mi Hyaluronic Acid Dưỡng Ẩm Da 25g, 25.000 ₫, 36%, 39.000 ₫, 
URIAGE, Xịt Khoáng Uriage Dưỡng Ẩm Cho Mọi Loại Da 300ml, 301.000 ₫, 25%, 400.000 ₫, 
Nivea, Tinh Chất Dưỡng Thể Nivea Vitamin Super C+ Sáng Da 320ml, 235.000 ₫, 3%, 242.000 ₫, 
Black Rouge, Son Kem Black Rouge MV01 Peach Pudding - Cam Đào Nude 4g, 188.000 ₫, 41%, 318.000 ₫, 
dProgram, Sữa Dưỡng d program Dưỡng Sáng & Làm Dịu Da 100ml, 699.000 ₫, 30%, 1.000.000 ₫, 
Bioderma, Gel Rửa Mặt Bioderma Dành Cho Da Dầu & Hỗn Hợp 200ml, 301.000 ₫, 30%, 430.000 ₫, 
Mise en scène, Bộ Gội Xả Mise En Scène Hỗ Trợ Phục Hồi Tóc Hư Tổn 530mlx2, 381.000 ₫, 17%, 460.000 ₫, 
CeraVe, [Mini] Sữa Rửa Mặt CeraVe Sạch Sâu Cho Da Thường Đến Da Dầu 30ml, 25.000 ₫, 37%, 40.000 ₫, 
Bamboo Salt, Kem Đánh Răng Bamboo Salt Muối Hồng Himalaya Sáng Răng 100g, 44.000 ₫, 32%, 65.000 ₫, 
Head & Shoulders, Dầu Gội Head & Shoulders Bạc Hà Mát Lạnh 170ml, 60.000 ₫, 12%, 68.000 ₫, 
Bio-essence, Mặt Nạ Bio-essence Tinh Chất Rau Má Phục Hồi Da 20ml, 22.000 ₫, 45%, 40.000 ₫, 
Angel's Liquid, Nước Thần Angel's Liquid Dưỡng Sáng, 428.000 ₫, 14%, 500.000 ₫, 
Angel's Liquid, Serum Angel's Liquid Xoá Thâm Đỏ Mờ Sạm Nám 30ml, 599.000 ₫, 25%, 799.000 ₫, 
Rejoice, Dầu Xả Rejoice Dưỡng Suôn Mượt Hương Nước Hoa Mẫu Đơn 320ml, 79.000 ₫, not available, not available, 
De Memoria, Sữa Tắm D​e M​emoria Sáng Da Hương Vanilla On Mars 300ml, 299.000 ₫, 46%, 550.000 ₫, 
Mentholatum Medi Lip, Son Dưỡng Mentholatum Chuyên Biệt Cho Môi Khô, 49.000 ₫, 24%, 64.500 ₫, 
Cocoon, Xịt Thâm Mụn Lưng Cocoon Chiết Xuất Bí Đao 140ml, 237.000 ₫, 11%, 265.000 ₫, 
Loli & The Wolf, Xịt Thơm Miệng Loli And The Wolf Original Bạc Hà The Mát 20ml, 138.000 ₫, 18%, 169.000 ₫, 
Eucryl, Combo 2 Kem Đánh Răng Eucryl Làm Trắng Răng Hương Bạc Hà 62g, 120.000 ₫, not available, not available, 
Black Rouge, Son Dưỡng Thuần Chay Có Màu Black Rouge J06 - Đỏ Nâu 3.3g, 165.000 ₫, 31%, 238.000 ₫, 
Kiehl's, Serum Kiehl's Giúp Da Tái Tạo, 1.485.000 ₫, 10%, 1.650.000 ₫, 
Naris Cosmetics, Son Thỏi Naris Cosmetics Mịn Môi 105 - Cam Ánh Đỏ 3g, 495.000 ₫, not available, not available, 
Senka, Sữa Rửa Mặt Senka Dạng Bọt Dành Cho Da Dầu 120g, 128.000 ₫, 31%, 184.800 ₫, 
Silkygirl, Bút Kẻ Mắt Nước Silkygirl Lâu Trôi 0.5g, 161.000 ₫, 1%, 162.000 ₫, 
L'Oreal, Nước Tẩy Trang L'Oreal Tươi Mát Cho Da Dầu, 158.000 ₫, 28%, 219.000 ₫, 
Klairs, Nước Hoa Hồng Klairs Không Mùi Cho Da Nhạy Cảm 180ml, 266.000 ₫, 35%, 409.000 ₫, 
La Roche-Posay, Kem Chống Nắng La Roche-Posay Kiểm Soát Dầu SPF50+ 50ml, 396.000 ₫, 26%, 535.000 ₫, 
Skin1004, Kem Chống Nắng Skin1004 Cho Da Nhạy Cảm SPF 50+ 50ml, 276.000 ₫, 35%, 425.000 ₫, 
L'Oreal, Nước Tẩy Trang L'Oreal Làm Sạch Sâu Trang Điểm 400ml, 159.000 ₫, 27%, 219.000 ₫, 
Anessa, Sữa Chống Nắng Anessa Dưỡng Da Kiềm Dầu 60ml, 393.000 ₫, 45%, 715.000 ₫, 
Bioderma, Nước Tẩy Trang Bioderma Dành Cho Da Nhạy Cảm 500ml, 393.000 ₫, 25%, 525.000 ₫, 
CeraVe, Sữa Rửa Mặt CeraVe Sạch Sâu Cho Da Thường Đến Da Dầu 473ml, 389.000 ₫, 12%, 440.000 ₫, 
Bioderma, Nước Tẩy Trang Bioderma Dành Cho Da Dầu & Hỗn Hợp 500ml, 393.000 ₫, 25%, 525.000 ₫, 
Anessa, Sữa Chống Nắng Anessa Cho Da Nhạy Cảm & Trẻ Em 60ml, 393.000 ₫, 45%, 715.000 ₫, 
Cosrx, Gel Rửa Mặt Cosrx Tràm Trà, 118.000 ₫, 65%, 339.000 ₫, 
Hatomugi, Sữa Tắm Hatomugi Dưỡng Ẩm, 80.000 ₫, 65%, 230.000 ₫, 
La Roche-Posay, Nước Tẩy Trang La Roche-Posay Dành Cho Da Nhạy Cảm 400ml, 370.000 ₫, 25%, 495.000 ₫, 
L'Oreal, Nước Tẩy Trang L'Oreal Dưỡng Ẩm Cho Da Thường, 159.000 ₫, 27%, 219.000 ₫, 
La Roche-Posay, Kem Dưỡng La Roche-Posay Giúp Phục Hồi Da Đa Công Dụng 40ml, 310.000 ₫, 21%, 390.000 ₫, 
Naruko, Hộp 10 Miếng Mặt Nạ Naruko Ý Dĩ Nhân Đỏ Sáng Da Mới 25ml/M, 228.000 ₫, 43%, 400.000 ₫, 
Nivea, Sáp Khử Mùi Nivea Sáng Mịn Mờ Vết Thâm 50ml, 90.000 ₫, 9%, 99.000 ₫, 
Liese, Bọt Kem Nhuộm Tóc Liese Màu Nâu Lạnh Airy Brown 108ml, 159.000 ₫, 33%, 239.000 ₫, 
Vegick, Serum Vegick Nhân Sâm Hỗ Trợ Trẻ Hóa Làn Da 30ml, 348.000 ₫, 30%, 495.000 ₫, 
Silkygirl, Bút Tạo Khối Silkygirl 2 Đầu 01 Natural Light 8g, 154.000 ₫, 29%, 218.000 ₫, 
Bioré, Serum Chống Nắng Dưỡng Thể Bioré Sáng Da Mịn Màng 50ml, 67.000 ₫, 15%, 79.000 ₫, 
L'Oreal, Dưỡng Chất L'Oreal Làm Căng Mướt Da 130ml, 369.000 ₫, 18%, 449.000 ₫, 
Cocoon, Combo Cocoon Tẩy Da Chết Toàn Thân & Môi Từ Cà Phê Đắk Lắk, 160.000 ₫, 20%, 200.000 ₫, 
Bio-essence, Mặt Nạ Ngủ Bio-essence Dưỡng Da Tươi Sáng Căng Mọng 50g, 439.000 ₫, 7%, 471.500 ₫, 
Mise en scène, Tinh Chất Dưỡng Tóc Mise en scène Giúp Tóc Suôn Mượt 80ml, 218.000 ₫, 25%, 289.000 ₫, 
Klairs, Mặt Nạ Klairs Làm Sạch & Dịu Mát Da 25ml, 42.000 ₫, 34%, 64.000 ₫, 
Acnes, Phim Thấm Dầu Acnes Oil Remover Film 50 Tờ, 54.000 ₫, 16%, 64.000 ₫, 
Lilybyred, Son Tint Lilybyred Siêu Lì 11 Gentle Coconut - Nâu Cam Sữa 4g, 145.000 ₫, 40%, 243.000 ₫, 
St.Ives, Sữa Dưỡng Thể St.Ives Collagen & Elastin Trẻ Hóa Da 621ml, 171.000 ₫, 11%, 192.000 ₫, 
Rejoice, Dầu Xả Rejoice Siêu Mềm Mượt 48 Giờ 320ml, 88.000 ₫, 1%, 89.000 ₫, 
X-Men, Sáp Vuốt Tóc X-Men Tạo Phồng & Giữ Nếp 8H 70g, 68.000 ₫, 16%, 81.000 ₫, 
Batiste, Dầu Gội Khô Batiste Hương Cổ Điển Nguyên Bản 200ml, 138.000 ₫, 12%, 156.000 ₫, 
Itoh Kanpo, Nước Uống Naris Itoh Dấm Táo Giảm Cân, 495.000 ₫, not available, not available, 
Skintific, Kem Dưỡng Skintific 5X Ceramide Cấp Ẩm, 82.000 ₫, 1%, 83.000 ₫, 
Bio-essence, Serum Bio-essence Dưỡng Sáng Da Chuyên Sâu 30ml, 518.000 ₫, 25%, 690.000 ₫, 
Nivea, Lăn Khử Mùi Nivea Serum Sáng Mịn Hương Hoa Lily 40ml, 69.000 ₫, 36%, 108.000 ₫, 
Versace, Nước Hoa Nam Versace Pour Homme EDT 50ml, 1.443.000 ₫, 19%, 1.782.000 ₫, 
Olay, Sữa Tắm Olay Tươi Mát Dài Lâu Lavender & Nước Bạch Dương 887ml, 217.000 ₫, 5%, 229.000 ₫, 
Banobagi, Combo Mặt Nạ Banobagi Dưỡng Sáng, 139.000 ₫, 37%, 220.000 ₫, 
Bioré, Sữa Chống Nắng Bioré Bảo Vệ Hoàn Hảo - Mát Lạnh 25ml, 58.000 ₫, 17%, 70.000 ₫, 
Laurier, Băng Vệ Sinh Laurier Safety Night Ban Đêm 30cm 8 Miếng, 28.000 ₫, 18%, 34.000 ₫, 
Tesori d'Oriente, Sữa Tắm Nước Hoa Tesori d'Oriente Hương Thanh Long 250ml, 148.000 ₫, 15%, 175.000 ₫, 
Frudia, Kem Dưỡng Da Tay Frudia Chiết Xuất Anh Đào 30ml, 48.000 ₫, 33%, 72.000 ₫, 
Banobagi, Mặt Nạ Banobagi Peptide Hỗ Trợ Phục Hồi Da (Tím Nhạt) 30g, 14.000 ₫, 49%, 27.500 ₫, 
Tsubaki, Bộ Chăm Sóc Tóc Tsubaki Phục Hồi Hư Tổn Nặng & Giảm Gãy Rụng 3 Món, 575.000 ₫, 25%, 767.000 ₫, 
Hotosu, Bộ Chiết Mỹ Phẩm Hotosu Xanh (9 Món), 39.000 ₫, 43%, 69.000 ₫, 
Closeup, Bàn Chải Đánh Răng Closeup Precision 1 Cái, 35.000 ₫, 20%, 44.000 ₫, 
Mise en scène, Tinh Chất Dưỡng Tóc Mise en scène Hương Nước Hoa 80ml, 239.000 ₫, 17%, 289.000 ₫, 
Maybelline, Son Lì Maybelline Mịn Môi Siêu Nhẹ 899 Đỏ Gạch 1.7g, 179.000 ₫, 21%, 228.000 ₫, 
Girlz Only, Dầu Gội Khô Girlz Only Cho Tóc Nâu, 89.000 ₫, 49%, 175.000 ₫, 
SEBAMED, Dung Dịch Vệ Sinh Phụ Nữ Sebamed PH 3.8 50ml, 110.000 ₫, 8%, 119.000 ₫, 
Selsun, Dầu Xả Selsun Dưỡng Tóc Ngăn Ngừa Gàu 100ml, 51.000 ₫, 12%, 58.000 ₫, 
BareSoul, Serum Nách BareSoul Khử Mùi, 205.000 ₫, 18%, 249.000 ₫, 
St.Ives, Sữa Tắm St.Ives Tẩy Tế Bào Chết Hương Cam Chanh 473ml, 128.000 ₫, 15%, 150.000 ₫, 
Caryophy, Combo 2 Kem Chống Nắng Caryophy Nâng Tone, 678.000 ₫, 6%, 720.000 ₫, 
L'Oreal, Nước Tẩy Trang L'Oreal Tươi Mát Cho Da Dầu, 158.000 ₫, 28%, 219.000 ₫, 
Klairs, Nước Hoa Hồng Klairs Không Mùi Cho Da Nhạy Cảm 180ml, 266.000 ₫, 35%, 409.000 ₫, 
La Roche-Posay, Kem Chống Nắng La Roche-Posay Kiểm Soát Dầu SPF50+ 50ml, 396.000 ₫, 26%, 535.000 ₫, 
Skin1004, Kem Chống Nắng Skin1004 Cho Da Nhạy Cảm SPF 50+ 50ml, 276.000 ₫, 35%, 425.000 ₫, 
L'Oreal, Nước Tẩy Trang L'Oreal Làm Sạch Sâu Trang Điểm 400ml, 159.000 ₫, 27%, 219.000 ₫, 
Anessa, Sữa Chống Nắng Anessa Dưỡng Da Kiềm Dầu 60ml, 393.000 ₫, 45%, 715.000 ₫, 
Bioderma, Nước Tẩy Trang Bioderma Dành Cho Da Nhạy Cảm 500ml, 393.000 ₫, 25%, 525.000 ₫, 
CeraVe, Sữa Rửa Mặt CeraVe Sạch Sâu Cho Da Thường Đến Da Dầu 473ml, 389.000 ₫, 12%, 440.000 ₫, 
Bioderma, Nước Tẩy Trang Bioderma Dành Cho Da Dầu & Hỗn Hợp 500ml, 393.000 ₫, 25%, 525.000 ₫, 
Anessa, Sữa Chống Nắng Anessa Cho Da Nhạy Cảm & Trẻ Em 60ml, 393.000 ₫, 45%, 715.000 ₫, 
Cosrx, Gel Rửa Mặt Cosrx Tràm Trà, 118.000 ₫, 65%, 339.000 ₫, 
Hatomugi, Sữa Tắm Hatomugi Dưỡng Ẩm, 80.000 ₫, 65%, 230.000 ₫, 
La Roche-Posay, Nước Tẩy Trang La Roche-Posay Dành Cho Da Nhạy Cảm 400ml, 370.000 ₫, 25%, 495.000 ₫, 
L'Oreal, Nước Tẩy Trang L'Oreal Dưỡng Ẩm Cho Da Thường, 159.000 ₫, 27%, 219.000 ₫, 
La Roche-Posay, Kem Dưỡng La Roche-Posay Giúp Phục Hồi Da Đa Công Dụng 40ml, 310.000 ₫, 21%, 390.000 ₫, 
Laura Anne, Nước Hoa Nữ Laura Anne Allure For Her 50ml (Hồng), 149.000 ₫, 50%, 299.000 ₫, 
Sofy, Băng Vệ Sinh Sofy Skin Comfort Mỏng Cánh 23cm 20 Miếng, 73.000 ₫, 28%, 101.702 ₫, 
Maybelline, Chì Kẻ Mày Maybelline 36H Lâu Trôi 01 Nâu Đậm 0.25g, 142.000 ₫, 24%, 188.000 ₫, 
Acnes, Sữa Rửa Mặt Acnes Dưỡng Sáng Và Ngăn Ngừa Mụn 100g, 53.000 ₫, 22%, 68.000 ₫, 
Baby Bright, Bảng Phấn Mắt Baby Bright Bronze Brown Tông Màu Đất 0.7g, 109.000 ₫, 22%, 139.000 ₫, 
Le Petit Olivier, Kem Ủ Tóc Le Petit Olivier Phục Hồi Sâu Hư Tổn 330ml, 218.000 ₫, 19%, 270.000 ₫, 
Naris Cosmetics, Sữa Rửa Mặt Và Tẩy Trang Naris Alodew Từ Lô Hội 100g, 354.000 ₫, not available, 355.000 ₫, 
Bioré, [Mua 1 Tặng 1] Sữa Tắm Bioré Guard Kháng Khuẩn Mát Lạnh Sảng Khoái 800g+220g, 141.000 ₫, 1%, 142.000 ₫, 
Lancôme, Nước Hoa Nữ Lancôme La Nuit Tresor EDP 75ml, 2.820.000 ₫, 9%, 3.100.000 ₫, 
australis, Phấn Nền Australis 3+1 Làm Sáng Da Tông Hồng Kem 9g, 256.000 ₫, 20%, 320.000 ₫, 
Suri, Chì Kẻ Mày Xé Suri 101 Black Màu Đen E271, 29.000 ₫, 9%, 32.000 ₫, 
VACOSI, Chì Mày Vacosi Định Hình Đa Năng 05 Nâu Tự Nhiên 5ml, 94.000 ₫, 16%, 112.000 ₫, 
Bioderma, Gel Dưỡng Ẩm Bioderma Làm Dịu Cho Da Rất Khô 500ml, 561.000 ₫, 10%, 625.000 ₫, 
SVR, Serum SVR Giúp Làm Sáng Da Và Ngăn Ngừa Nếp Nhăn 30ml, 935.000 ₫, 15%, 1.100.000 ₫, 
Banobagi, Mặt Nạ Banobagi Hỗ Trợ Giảm Mụn (Tím Đậm) 30g, 14.000 ₫, 49%, 27.500 ₫, 
Maybelline, Phấn Má Hồng Maybelline Mịn Lì Chuẩn Màu 10 Brave 4.5g, 112.000 ₫, 24%, 148.000 ₫, 
Anessa, Combo Anessa Sữa Chống Nắng Kiềm Dầu 60ml + Xịt Chống Nắng Đa Năng 60g, 702.000 ₫, 40%, 1.170.000 ₫, 
Derladie, Tinh Chất Derladie Tràm Trà Làm Giảm Mụn 30ml, 399.000 ₫, 33%, 599.000 ₫, 
VACOSI, Bút Kẻ Mắt Nước Vacosi 24H Không Lem Màu Đen (Bản Mới) 0.6g, 126.000 ₫, 20%, 158.000 ₫, 
Cocoon, Combo 2 Tinh Chất Cocoon Nghệ Hưng Yên x2.2 Sáng Da Chuyên Sâu 30ml, 838.000 ₫, 10%, 930.000 ₫, 
Nivea, Nước Tẩy Trang Nivea Dưỡng Sáng Da 400ml, 183.000 ₫, 3%, 189.000 ₫, 
Bioré, Essence Chống Nắng Bioré Màng Nước Dưỡng Ẩm Da 50g, 144.000 ₫, 26%, 195.000 ₫, 
MegRhythm, Combo MegRhythm 2 Hộp Mặt Xông Hơi Mắt (Không Hương) + Tặng 1 Hộp Miếng Dán Xông Hơi Vùng Bụng, 248.000 ₫, 41%, 420.000 ₫, 
Make p:rem, Kem Chống Nắng Make p:rem Hóa Học Cấp Ẩm Mỏng Nhẹ 50ml, 309.000 ₫, 36%, 480.000 ₫, 
Nivea, Xịt Khử Mùi Nivea Serum Sáng Da Hoa Anh Đào 150ml, 112.000 ₫, 10%, 125.000 ₫, 
Marvis, Kem Đánh Răng Marvis Màu Xanh Dương Hương Dưa Gang 85ml, 167.000 ₫, 36%, 259.000 ₫, 
Old Spice, Sáp Khử Mùi Old Spice Hương Wilderness Sức Hút Hoang Dã 85g, 141.000 ₫, 16%, 167.000 ₫, 
Naruko, Hộp 10 Miếng Mặt Nạ Naruko Hoa Hồng Nhung Cấp Nước 25ml/M, 184.000 ₫, 37%, 290.000 ₫, 
Olaplex, Dầu Gội Olaplex No.4 Phục Hồi, 690.000 ₫, 22%, 890.000 ₫, 
Unicharm 3D Mask, Combo 10 Gói Khẩu Trang Unicharm 3D Mask Ngăn Khói Bụi Size M, 138.000 ₫, 23%, 180.000 ₫, 
Halio, Máy Rửa Mặt Halio Dành Cho Mọi Loại Da Màu Hồng Đậm, 552.000 ₫, 32%, 810.000 ₫, 
Bioré, Sữa Chống Nắng Bioré Chống Thấm Nước SPF 50+/PA++++ 40ml, 81.000 ₫, 21%, 102.000 ₫, 
L'Oreal, Dầu Xả L'Oreal Paris Giảm 5 Dấu Hiệu Của Tóc Hư Tổn 280ml, 106.000 ₫, 18%, 129.000 ₫, 
Refre, Xịt Khử Mùi Refre Natural Hương Gỗ 30ml, 51.000 ₫, 18%, 62.000 ₫, 
Forencos, Serum Chống Nắng Forencos Dưỡng Sáng Da 30ml, 250.000 ₫, 50%, 500.000 ₫, 
Skin1004, Sữa Rửa Mặt Skin1004 Rau Má Dưỡng Sáng Da 125ml, 250.000 ₫, 35%, 385.000 ₫, 
DHC, Viên Uống DHC Việt Quất Cải Thiện Thị Lực Gói 60 Viên 30 Ngày, 299.000 ₫, 25%, 400.000 ₫, 
Gillette, Lưỡi Dao Cạo Râu Gillette Vector Vỉ 4 Cái, 59.000 ₫, 6%, 63.000 ₫, 
VACOSI, Chì Mày Vacosi Định Hình Đa Năng 04 Xám Đậm 5ml, 96.000 ₫, 14%, 112.000 ₫, 
LilyBell, Bông Tẩy Trang LilyBell Vỏ Xanh 240 Miếng, 58.000 ₫, 17%, 70.000 ₫, 
L'Oreal, Nước Tẩy Trang L'Oreal Tươi Mát Cho Da Dầu, 158.000 ₫, 28%, 219.000 ₫, 
Klairs, Nước Hoa Hồng Klairs Không Mùi Cho Da Nhạy Cảm 180ml, 266.000 ₫, 35%, 409.000 ₫, 
La Roche-Posay, Kem Chống Nắng La Roche-Posay Kiểm Soát Dầu SPF50+ 50ml, 396.000 ₫, 26%, 535.000 ₫, 
Skin1004, Kem Chống Nắng Skin1004 Cho Da Nhạy Cảm SPF 50+ 50ml, 276.000 ₫, 35%, 425.000 ₫, 
L'Oreal, Nước Tẩy Trang L'Oreal Làm Sạch Sâu Trang Điểm 400ml, 159.000 ₫, 27%, 219.000 ₫, 
Anessa, Sữa Chống Nắng Anessa Dưỡng Da Kiềm Dầu 60ml, 393.000 ₫, 45%, 715.000 ₫, 
Bioderma, Nước Tẩy Trang Bioderma Dành Cho Da Nhạy Cảm 500ml, 393.000 ₫, 25%, 525.000 ₫, 
CeraVe, Sữa Rửa Mặt CeraVe Sạch Sâu Cho Da Thường Đến Da Dầu 473ml, 389.000 ₫, 12%, 440.000 ₫, 
Bioderma, Nước Tẩy Trang Bioderma Dành Cho Da Dầu & Hỗn Hợp 500ml, 393.000 ₫, 25%, 525.000 ₫, 
Anessa, Sữa Chống Nắng Anessa Cho Da Nhạy Cảm & Trẻ Em 60ml, 393.000 ₫, 45%, 715.000 ₫, 
Cosrx, Gel Rửa Mặt Cosrx Tràm Trà, 118.000 ₫, 65%, 339.000 ₫, 
Hatomugi, Sữa Tắm Hatomugi Dưỡng Ẩm, 80.000 ₫, 65%, 230.000 ₫, 
La Roche-Posay, Nước Tẩy Trang La Roche-Posay Dành Cho Da Nhạy Cảm 400ml, 370.000 ₫, 25%, 495.000 ₫, 
L'Oreal, Nước Tẩy Trang L'Oreal Dưỡng Ẩm Cho Da Thường, 159.000 ₫, 27%, 219.000 ₫, 
La Roche-Posay, Kem Dưỡng La Roche-Posay Giúp Phục Hồi Da Đa Công Dụng 40ml, 310.000 ₫, 21%, 390.000 ₫, 
Cathy Doll, Kem Che Khuyết Điểm Cathy Doll Mịn Lì 02 Da Sáng 2.4g, 109.000 ₫, not available, not available, 
Vichy, Combo Kem Chống Nắng Vichy Ngừa Lão Hóa SPF50 50ml + Nước Tẩy Trang La Roche Posay Da Nhạy Cảm 50ml, 453.000 ₫, 23%, 590.000 ₫, 
SVR, Combo SVR Làm Sạch Cho Da Dầu Mụn, 789.000 ₫, 19%, 970.000 ₫, 
Neutrogena, Sữa Rửa Mặt Neutrogena Ngăn Ngừa Mụn 175ml, 172.000 ₫, 30%, 246.000 ₫, 
Silcot, Combo 2 Bông Đắp Dưỡng Silcot Miếng Đôi 40 Miếng/Hộp, 82.000 ₫, 25%, 110.000 ₫, 
Black Rouge, Son Kem Lì Black Rouge A52 Cinnamon Brown - Nâu Quế 4.5ml, 169.000 ₫, 43%, 298.000 ₫, 
CeraVe, Sữa Dưỡng Thể CeraVe Cho Da Thường Đến Da Khô 473ml, 432.000 ₫, 10%, 480.000 ₫, 
Foodaholic, Mặt Nạ Foodaholic Chiết Xuất Tổ Yến Cấp Nước, 8.000 ₫, 64%, 22.000 ₫, 
Teana, Serum Teana Giảm Đỏ, 335.000 ₫, 24%, 440.000 ₫, 
Costar, Viên Uống Costar Sữa Ong Chúa 100 Viên, 249.000 ₫, 37%, 396.000 ₫, 
Olay, Combo 2 Kem Dưỡng Olay Luminous Sáng Da Mờ Thâm Nám Ban Đêm 50g, 381.000 ₫, 29%, 540.000 ₫, 
Double Rich, Kem Ủ Tóc Double Rich Chuyên Sâu Cho Tóc Nhuộm 150g, 53.000 ₫, 33%, 79.000 ₫, 
Paco Rabanne, Nước Hoa Nam Paco Rabanne 1 Million Parfum EDP 100ml, 3.024.000 ₫, 10%, 3.360.000 ₫, 
Banana Boat, Kem Chống Nắng Banana Boat SPF50 PA+++ 90ml, 149.000 ₫, 12%, 170.000 ₫, 
Silkygirl, Phấn Má Hồng Silkygirl 01 Cam Đào Trẻ Trung, 156.000 ₫, 7%, 168.000 ₫, 
St.Ives, Sữa Rửa Mặt St.Ives Tẩy Tế Bào Chết Hoa Hồng & Lô Hội 170g, 135.000 ₫, not available, not available, 
Durex, Bao Cao Su Durex Kéo Dài Thời Gian Size 52mm (Hộp 3 Cái), 62.000 ₫, 14%, 72.000 ₫, 
Nivea, Xịt Khử Mùi Nivea Ngăn Ố Vàng Thanh Mát Dịu Nhẹ 150ml, 86.000 ₫, 21%, 109.000 ₫, 
Double Rich, Sữa Tắm Double Rich Blooming Love Hương Hoa Anh Đào 800g, 134.000 ₫, 16%, 159.000 ₫, 
Old Spice, Sáp Khử Mùi Old Spice Hương NightPanther Ấm Áp Và Lịch Lãm 85g, 166.000 ₫, 1%, 167.000 ₫, 
Hada Labo, Bộ Sản Phẩm Hada Labo Dưỡng Ẩm Da 3 Món (Kem Rửa Mặt 15g + Dung Dịch Dưỡng 20ml + Kem Dưỡng 12g), 76.000 ₫, 11%, 85.000 ₫, 
B.O.M, Son Kem Lì B.O.M #H BG 501 Vintage Brick - Đỏ Gạch 8.5g, 322.000 ₫, 7%, 348.000 ₫, 
Cosrx, Nước Hoa Hồng Cosrx Tẩy Tế Bào Chết Hoá Học 150ml, 278.000 ₫, 35%, 429.000 ₫, 
Dove, Kem Xả Dove Ngăn Gãy Rụng Tóc (Mới) 320g, 89.000 ₫, 11%, 100.000 ₫, 
Bioderma, Kem Dưỡng Bioderma Hỗ Trợ Phục Hồi, 441.000 ₫, 16%, 525.000 ₫, 
OGX, Dầu Xả OGX Argan Oil Giúp Phục Hồi Tóc Hư Tổn 385ml, 208.000 ₫, 29%, 295.000 ₫, 
Cell Fusion C, Combo Kem Chống Nắng Cell Fusion C Làm Dịu Tổn Thương 35mlx2, 529.000 ₫, 19%, 650.000 ₫, 
Nivea, Combo 2 Lăn Khử Mùi Nivea Sáng Mịn Se Khít Lỗ Chân Lông 50ml, 178.000 ₫, 3%, 184.000 ₫, 
Swiss Image, Nước Tẩy Trang Swiss Image 3 Trong 1 Sạch Sâu 400ml, 330.000 ₫, 20%, 412.000 ₫, 
Parisian, Sữa Tắm Parisian Nước Hoa Nữ - Chic For Her 265ml, 71.000 ₫, 35%, 109.000 ₫, 
Naris Cosmetics, Sữa Tắm Naris Nature Dịu Nhẹ Hương Hoa Tươi Mát 500ml, 329.000 ₫, 17%, 395.000 ₫, 
Dove, Dầu Gội Dove Tóc Phồng Dày & Ngăn Lão Hóa 380ml, 140.000 ₫, 39%, 230.000 ₫, 
Garnier, Combo Garnier Nước Tẩy Trang Và Serum Cho Da Dầu, 389.000 ₫, 22%, 498.000 ₫, 
Fino, Combo 2 Kem Ủ Tóc Fino Cao Cấp Giúp Phục Hồi Hư Tổn 230g, 292.000 ₫, 30%, 418.000 ₫, 
Naris Cosmetics, Kem Nền BB Naris Cosmetics Alius 02 Natural Beige 30g, 337.000 ₫, 10%, 375.000 ₫, 
VACOSI, Phấn Má Hồng Vacosi 03 Sweet Peach 5g, 79.000 ₫, 16%, 94.000 ₫, 
Malissa Kiss, Xịt Thơm Toàn Thân Malissa Kiss Hương Nước Hoa Passion 88ml, 99.000 ₫, 41%, 169.000 ₫, 
australis, Phấn Highlight Australis Bắt Sáng Dạng Ánh Nhũ 6.5g (Mới), 145.000 ₫, 18%, 176.000 ₫, 
Obagi, Kem Dưỡng Obagi Cấp Ẩm Giàu Dưỡng Chất 48g, 1.445.000 ₫, 15%, 1.700.000 ₫, 
Enchanteur, Sữa Tắm Enchanteur Nước Hoa Dưỡng Da Sensation 650g, 145.000 ₫, 22%, 187.000 ₫, 
L'Oreal, Nước Tẩy Trang L'Oreal Tươi Mát Cho Da Dầu, 158.000 ₫, 28%, 219.000 ₫, 
Klairs, Nước Hoa Hồng Klairs Không Mùi Cho Da Nhạy Cảm 180ml, 266.000 ₫, 35%, 409.000 ₫, 
La Roche-Posay, Kem Chống Nắng La Roche-Posay Kiểm Soát Dầu SPF50+ 50ml, 396.000 ₫, 26%, 535.000 ₫, 
Skin1004, Kem Chống Nắng Skin1004 Cho Da Nhạy Cảm SPF 50+ 50ml, 276.000 ₫, 35%, 425.000 ₫, 
L'Oreal, Nước Tẩy Trang L'Oreal Làm Sạch Sâu Trang Điểm 400ml, 159.000 ₫, 27%, 219.000 ₫, 
Anessa, Sữa Chống Nắng Anessa Dưỡng Da Kiềm Dầu 60ml, 393.000 ₫, 45%, 715.000 ₫, 
Bioderma, Nước Tẩy Trang Bioderma Dành Cho Da Nhạy Cảm 500ml, 393.000 ₫, 25%, 525.000 ₫, 
CeraVe, Sữa Rửa Mặt CeraVe Sạch Sâu Cho Da Thường Đến Da Dầu 473ml, 389.000 ₫, 12%, 440.000 ₫, 
Bioderma, Nước Tẩy Trang Bioderma Dành Cho Da Dầu & Hỗn Hợp 500ml, 393.000 ₫, 25%, 525.000 ₫, 
Anessa, Sữa Chống Nắng Anessa Cho Da Nhạy Cảm & Trẻ Em 60ml, 393.000 ₫, 45%, 715.000 ₫, 
Cosrx, Gel Rửa Mặt Cosrx Tràm Trà, 118.000 ₫, 65%, 339.000 ₫, 
Hatomugi, Sữa Tắm Hatomugi Dưỡng Ẩm, 80.000 ₫, 65%, 230.000 ₫, 
La Roche-Posay, Nước Tẩy Trang La Roche-Posay Dành Cho Da Nhạy Cảm 400ml, 370.000 ₫, 25%, 495.000 ₫, 
L'Oreal, Nước Tẩy Trang L'Oreal Dưỡng Ẩm Cho Da Thường, 159.000 ₫, 27%, 219.000 ₫, 
La Roche-Posay, Kem Dưỡng La Roche-Posay Giúp Phục Hồi Da Đa Công Dụng 40ml, 310.000 ₫, 21%, 390.000 ₫, 
82X, Nước Uống Collagen 82X The Pink Làm Đẹp Da 100mlx10 Chai, 520.000 ₫, 10%, 580.000 ₫, 
Naris Cosmetics, Kem Dưỡng Mắt Naris Cosmetics Sáng Da, 294.000 ₫, 19%, 365.000 ₫, 
Evian, Xịt Khoáng Evian Cấp Ẩm Và Làm Dịu Da 50ml, 100.000 ₫, 26%, 135.000 ₫, 
Tenamyd, Kem Chống Nắng Tenamyd Vật Lý SPF50+ PA++++ 50g, 650.000 ₫, not available, not available, 
Naris Cosmetics, Son Thỏi Naris Cosmetics Mịn Môi 104 - Đỏ Cherry 3g, 495.000 ₫, not available, not available, 
Bioré, Sữa Chống Nắng Bioré Sáng Mịn Kiềm Dầu SPF 50+/PA++++ 30ml, 81.000 ₫, 21%, 102.000 ₫, 
