3CE, Son Thỏi 3CE Vỏ Trong Màu Lì Orange Breeze - Cam Gạch Pha Đỏ 3.5g (HSD: 10/10/2025), 101.000 ₫, 7%, 109.000 ₫, 
Tsubaki, Dầu Gội Khô Tsubaki Dạng Gel Dành Cho Tóc Dầu, 137.000 ₫, 31%, 199.000 ₫, 
Felina, Sơn Móng Tay Felina Màu Đen CS902 18ml, 38.000 ₫, 22%, 49.000 ₫, 
La Roche-Posay, Kem Chống Nắng La Roche-Posay Không Màu Kiểm Soát Dầu 15ml, 205.000 ₫, 18%, 250.000 ₫, 
Some By Mi, Mặt Nạ Dưỡng Da Some By Mi Lô Hội Dưỡng Ẩm, 18.000 ₫, 28%, 25.000 ₫, 
50 Megumi, Dầu Xả 50 Megumi Suôn Mềm & Ẩm Mượt Tóc 400ml, 199.000 ₫, 20%, 250.000 ₫, 
Rexona, Lăn Khử Mùi Cho Nam Rexona Khô Thoáng Ice Cool 50ml, 51.000 ₫, 18%, 62.000 ₫, 
Botanic, [HSD 04/2024] Serum Mentholatum Botanic Chiết Xuất Hệ Thực Vật 30g, 63.000 ₫, 62%, 165.000 ₫, 
Mise en scène, Dầu Gội Mise en scène Hỗ Trợ Phục Hồi Tóc Hư Tổn 200ml, 89.000 ₫, 18%, 108.000 ₫, 
ola, Bông Tẩy Trang Ola Silk Sense 120 Miếng, 29.000 ₫, not available, not available, 
Sensodyne, Kem Đánh Răng Sensodyne Rapid Action Giảm Ê Buốt Nhanh 100g, 98.000 ₫, 10%, 108.900 ₫, 
Curél, Sữa Chống Nắng Curél Cho Da Mặt Khô Nhạy Cảm 30ml, 405.000 ₫, 20%, 508.000 ₫, 
Luvmier, Kem Dưỡng Luvmier Làm Sáng Da Ban Đêm 30g, 288.000 ₫, not available, 289.000 ₫, 
Organic Shop, Kem Ủ Tóc Organic Shop Chiết Xuất Dừa Và Bơ Hạt Mỡ 250ml, 114.000 ₫, 33%, 169.000 ₫, 
Make p:rem, [Mini] Bộ 3 Kem Chống Nắng Make p:rem 1ml/ Gói, 40.000 ₫, not available, not available, 
Tsubaki, Combo Dầu Gội Tsubaki Dưỡng Bóng Mượt 490ml + Sữa Tắm Senka Hoa Tươi Mát 500ml, 297.000 ₫, 28%, 413.000 ₫, 
Cathy Doll, Serum Cathy Doll Vitamin C Dưỡng Sáng, 399.000 ₫, not available, not available, 
Jmella, Sữa Dưỡng Thể Jmella Hương Chanh Và Húng Quế Tươi Mát 500ml, 133.000 ₫, 30%, 190.000 ₫, 
Jmella, Dầu Xả Jmella Hương Cam Quýt Và Mẫu Đơn Sang Trọng 500ml, 133.000 ₫, 30%, 190.000 ₫, 
Curél, Tinh Chất Chống Nắng Curél Mặt & Toàn Thân Cho Da Khô Nhạy Cảm 50g, 454.000 ₫, 11%, 508.000 ₫, 
Maybelline, Phấn Nước Maybelline Mịn Nhẹ Kiềm Dầu 128 Warm Nude 14g, 398.000 ₫, 20%, 498.000 ₫, 
Sexylook, Mặt Nạ Bùn & Sữa Rửa Mặt Sexylook Dưỡng Sáng Vượt Trội 150g, 199.000 ₫, 62%, 529.000 ₫, 
LEMONADE, Son Kem Lì Lemonade Màu Cam Đỏ Đất 04 Super Strong 5g, 199.000 ₫, 20%, 249.000 ₫, 
Remos, Kem Chống Muỗi Rohto Remos Hương Lavender 70g, 21.000 ₫, 19%, 26.000 ₫, 
Felina, Nước Rửa Móng Felina Cao Cấp Hương Hoa Cỏ 175ml, 49.000 ₫, 29%, 69.000 ₫, 
La Roche-Posay, Combo La Roche-Posay Tẩy Trang & Rửa Mặt Cho Da Thường, 433.000 ₫, 32%, 640.000 ₫, 
OXY, Bộ Sản Phẩm OXY Làm Sạch Sâu, 198.000 ₫, 10%, 220.000 ₫, 
L'Oreal, Nước Tẩy Trang L'Oreal Tươi Mát Cho Da Dầu, 158.000 ₫, 28%, 219.000 ₫, 
Klairs, Nước Hoa Hồng Klairs Không Mùi Cho Da Nhạy Cảm 180ml, 266.000 ₫, 35%, 409.000 ₫, 
La Roche-Posay, Kem Chống Nắng La Roche-Posay Kiểm Soát Dầu SPF50+ 50ml, 396.000 ₫, 26%, 535.000 ₫, 
Skin1004, Kem Chống Nắng Skin1004 Cho Da Nhạy Cảm SPF 50+ 50ml, 276.000 ₫, 35%, 425.000 ₫, 
L'Oreal, Nước Tẩy Trang L'Oreal Làm Sạch Sâu Trang Điểm 400ml, 159.000 ₫, 27%, 219.000 ₫, 
Anessa, Sữa Chống Nắng Anessa Dưỡng Da Kiềm Dầu 60ml, 393.000 ₫, 45%, 715.000 ₫, 
Bioderma, Nước Tẩy Trang Bioderma Dành Cho Da Nhạy Cảm 500ml, 393.000 ₫, 25%, 525.000 ₫, 
CeraVe, Sữa Rửa Mặt CeraVe Sạch Sâu Cho Da Thường Đến Da Dầu 473ml, 389.000 ₫, 12%, 440.000 ₫, 
Bioderma, Nước Tẩy Trang Bioderma Dành Cho Da Dầu & Hỗn Hợp 500ml, 393.000 ₫, 25%, 525.000 ₫, 
Anessa, Sữa Chống Nắng Anessa Cho Da Nhạy Cảm & Trẻ Em 60ml, 393.000 ₫, 45%, 715.000 ₫, 
Cosrx, Gel Rửa Mặt Cosrx Tràm Trà, 118.000 ₫, 65%, 339.000 ₫, 
Hatomugi, Sữa Tắm Hatomugi Dưỡng Ẩm, 80.000 ₫, 65%, 230.000 ₫, 
La Roche-Posay, Nước Tẩy Trang La Roche-Posay Dành Cho Da Nhạy Cảm 400ml, 370.000 ₫, 25%, 495.000 ₫, 
L'Oreal, Nước Tẩy Trang L'Oreal Dưỡng Ẩm Cho Da Thường, 159.000 ₫, 27%, 219.000 ₫, 
La Roche-Posay, Kem Dưỡng La Roche-Posay Giúp Phục Hồi Da Đa Công Dụng 40ml, 310.000 ₫, 21%, 390.000 ₫, 
Liese, Bọt Kem Nhuộm Tóc Liese Màu Nâu Kẹo Ngọt 108ml, 159.000 ₫, 33%, 239.000 ₫, 
Naris Cosmetics, Son Lì Naris Cosmetic Lâu Trôi Màu Hồng 165 Frosted Pink 3.7g, 145.000 ₫, 14%, 169.000 ₫, 
MegRhythm, Miếng Dán Xông Hơi MegRhythm Good-Night Oải Hương 5 Miếng, 132.000 ₫, 6%, 140.000 ₫, 
Naris Cosmetics, Mặt Nạ Naris Chieno Shizuku Đông Y Dưỡng Ẩm Da 7 Miếng, 394.000 ₫, not available, 395.000 ₫, 
Blossomy, Thực Phẩm Bảo Vệ Sức Khỏe Blossomy Nghệ Collagen 50mlx3, 130.000 ₫, 21%, 165.000 ₫, 
Silkygirl, Combo 2 Xịt Thơm Toàn Thân Và Tóc Silkygirl Hương Love Bloom + Floral Blush 50ml, 149.000 ₫, 15%, 176.000 ₫, 
Beauty Buffet, Sữa Tắm Beauty Buffet Dưỡng Sáng & Phục Hồi Da 450ml, 249.000 ₫, not available, not available, 
Dental Clinic 2080, Kem Đánh Răng Dental Clinic 2080 Hương Dâu Cho Trẻ Em 80g, 28.000 ₫, not available, not available, 
Milaganics, Son Dưỡng Môi Milaganics Trà Xanh Dưỡng Ẩm, 25.000 ₫, 66%, 74.000 ₫, 
Felina, Sơn Móng Tay Felina Màu Trắng Sữa CS003 18ml, 38.000 ₫, 22%, 49.000 ₫, 
innisfree, Phấn Nước innisfree Kiềm Dầu Màu 21C Rose Vanilla 14g, 390.000 ₫, 25%, 520.000 ₫, 
LipIce, Son Dưỡng Lipice Trái Cây Berry - Đỏ Mọng 4g, 78.000 ₫, 24%, 103.000 ₫, 
australis, Phấn Mắt Australis Neutralize 2 Eyeshadow Palette 22.5g, 388.000 ₫, 20%, 485.000 ₫, 
Kiehl's, [HSD 04/2024] [Hàng Tách Set] Mặt Nạ Kiehl's Từ Dầu Quả Bơ Dưỡng Ẩm Da 25g, 220.000 ₫, 60%, 550.000 ₫, 
australis, Bảng Phấn Mắt Australis 20 Màu Lấp Lánh 20g, 388.000 ₫, 20%, 485.000 ₫, 
Beautylabo, Thuốc Nhuộm Tóc Beautylabo Vanity Dạng Kem Nâu Ánh Tím 133ml, 97.000 ₫, 50%, 195.000 ₫, 
Lebelage, Mặt Nạ Lebelage Coenzyme Q10 Chống Oxy Hóa, 9.000 ₫, 40%, 15.000 ₫, 
Milaganics, Tẩy Tế Bào Chết Toàn Thân Milaganics Từ Cà Phê 200g (Mới), 129.000 ₫, 35%, 199.000 ₫, 
Milaganics, Kem Ủ Tóc Milaganics Tinh Dầu Bưởi Phục Hồi Hư Tổn 200g (Mới), 129.000 ₫, 35%, 199.000 ₫, 
Ya Samaya, Combo 2 Bông Tẩy Trang Ya Samaya Cotton Pads 120 Miếng, 43.000 ₫, 52%, 90.000 ₫, 
Freeman, [HSD 11/2024] Mặt Nạ Freeman Bùn, 129.000 ₫, 22%, 165.000 ₫, 
Silkygirl, Son Dưỡng Có Màu Silkygirl 01 Naked​ - Hồng Da Nâu 3.2g, 134.000 ₫, 20%, 168.000 ₫, 
Laurier, Combo 4 Băng Vệ Sinh Laurier Hàng Ngày Hương Trái Cây 20 Miếng, 56.000 ₫, 22%, 72.000 ₫, 
Lilybyred, Mascara Lông Mày Lilybyred Lâu Trôi 01 Nâu Sáng 3.5g, 128.000 ₫, 32%, 187.000 ₫, 
X-Men For Boss, Dầu Gội X-Men For Boss Luxury Hương Sang Trọng Tinh Tế 650g, 192.000 ₫, 12%, 218.000 ₫, 
Old Spice, Gel Tắm Old Spice Hương Tươi Mát Và Sống Động 532ml, 139.000 ₫, 9%, 152.000 ₫, 
JMsolution, Mặt Nạ JMsolution Collagen Cải Thiện Độ Đàn Hồi 30ml, 38.000 ₫, 3%, 39.000 ₫, 
50 Megumi, Dầu Gội 50 Megumi Mềm Mượt Và Dưỡng Ẩm 400ml (Mới), 191.000 ₫, 24%, 250.000 ₫, 
Closeup, Combo 3 Kem Đánh Răng Closeup Muối Biển Detox Trắng Răng 230g, 133.000 ₫, 13%, 153.000 ₫, 
Calvin Klein, [Mini] Nước Hoa Nam Calvin Klein Defy For Men EDT 10ml, 380.000 ₫, not available, not available, 
Silkygirl, Kem Che Khuyết Điểm Silkygirl 01 Light Tông Sáng 2ml, 157.000 ₫, 1%, 158.000 ₫, 
JMsolution, Mặt Nạ JMsolution Tôm Dưỡng Sáng Da, 18.000 ₫, 28%, 25.000 ₫, 
Dermal, Mặt Nạ Dermal Chiết Xuất Ngọc Trai Dưỡng Sáng Da 23g, 9.000 ₫, 36%, 14.000 ₫, 
innisfree, Mặt Nạ Giấy innisfree Sáng Da Từ Trà Kombucha 22ml, 20.000 ₫, 26%, 27.000 ₫, 
Agi, Khăn Ướt AGI Không Hương 100 Tờ (Vịt Vàng), 42.000 ₫, 11%, 47.000 ₫, 
Hada Labo, Nước Tẩy Trang Hada Labo Sạch Sâu Dưỡng Ẩm 40ml, 42.000 ₫, 16%, 50.000 ₫, 
Cetaphil, Sữa Tắm Cetaphil Dưỡng Ẩm Dịu Lành Cho Bé 230ml, 189.000 ₫, 16%, 225.000 ₫, 
Sensodyne, Bộ 2 Kem Đánh Răng Sensodyne Cool Gel 100g, 126.000 ₫, 28%, 176.000 ₫, 
3CE, Son Bóng 3CE Căng Mọng Sweetner - Hồng San Hô 3g, 358.000 ₫, 6%, 380.000 ₫, 
Mediheal, Mặt Nạ Mediheal Dịu Da, 15.000 ₫, 48%, 29.000 ₫, 
L'Oreal, Nước Tẩy Trang L'Oreal Tươi Mát Cho Da Dầu, 158.000 ₫, 28%, 219.000 ₫, 
Klairs, Nước Hoa Hồng Klairs Không Mùi Cho Da Nhạy Cảm 180ml, 266.000 ₫, 35%, 409.000 ₫, 
La Roche-Posay, Kem Chống Nắng La Roche-Posay Kiểm Soát Dầu SPF50+ 50ml, 396.000 ₫, 26%, 535.000 ₫, 
Skin1004, Kem Chống Nắng Skin1004 Cho Da Nhạy Cảm SPF 50+ 50ml, 276.000 ₫, 35%, 425.000 ₫, 
L'Oreal, Nước Tẩy Trang L'Oreal Làm Sạch Sâu Trang Điểm 400ml, 159.000 ₫, 27%, 219.000 ₫, 
Anessa, Sữa Chống Nắng Anessa Dưỡng Da Kiềm Dầu 60ml, 393.000 ₫, 45%, 715.000 ₫, 
Bioderma, Nước Tẩy Trang Bioderma Dành Cho Da Nhạy Cảm 500ml, 393.000 ₫, 25%, 525.000 ₫, 
CeraVe, Sữa Rửa Mặt CeraVe Sạch Sâu Cho Da Thường Đến Da Dầu 473ml, 389.000 ₫, 12%, 440.000 ₫, 
Bioderma, Nước Tẩy Trang Bioderma Dành Cho Da Dầu & Hỗn Hợp 500ml, 393.000 ₫, 25%, 525.000 ₫, 
Anessa, Sữa Chống Nắng Anessa Cho Da Nhạy Cảm & Trẻ Em 60ml, 393.000 ₫, 45%, 715.000 ₫, 
Cosrx, Gel Rửa Mặt Cosrx Tràm Trà, 118.000 ₫, 65%, 339.000 ₫, 
Hatomugi, Sữa Tắm Hatomugi Dưỡng Ẩm, 80.000 ₫, 65%, 230.000 ₫, 
La Roche-Posay, Nước Tẩy Trang La Roche-Posay Dành Cho Da Nhạy Cảm 400ml, 370.000 ₫, 25%, 495.000 ₫, 
L'Oreal, Nước Tẩy Trang L'Oreal Dưỡng Ẩm Cho Da Thường, 159.000 ₫, 27%, 219.000 ₫, 
La Roche-Posay, Kem Dưỡng La Roche-Posay Giúp Phục Hồi Da Đa Công Dụng 40ml, 310.000 ₫, 21%, 390.000 ₫, 
Maybelline, Son Kem Maybelline Mịn Lì CM07 Hồng Ngọt Nắng 6.4ml, 179.000 ₫, 21%, 228.000 ₫, 
Black Rouge, Son Thỏi Black Rouge WL05 Scarlet Brown - Nâu Trầm 4.4g, 189.000 ₫, 44%, 338.000 ₫, 
KAI, Dao Cạo Chân Mày Kai Groom Eyebrow Razor 1 Cây, 13.000 ₫, 48%, 25.000 ₫, 
Arrahan, Gel Tẩy Tế Bào Chết Arrahan Hương Aroma 180ml, 95.000 ₫, 30%, 135.000 ₫, 
50 Megumi, Dầu Xả 50 Megumi Sạch Thoáng & Tươi Mát Tóc 400ml, 188.000 ₫, 25%, 250.000 ₫, 
Tesori d'Oriente, [Mini] 1 Gói Sữa Tắm Nước Hoa Tesori d'Oriente 7ml (Mùi Ngẫu Nhiên), 15.000 ₫, not available, not available, 
Remos, Combo Xịt Và Kem Chống Muỗi Remos Hương Lavender & Khuynh Diệp, 75.000 ₫, 15%, 88.000 ₫, 
BareSoul, Dầu Gội Khô BareSoul Giảm Dầu Thừa & Làm Phồng Tóc 50g, 125.000 ₫, 22%, 160.000 ₫, 
Gilaa, Son Kem Lì Gilaa Thế Hệ Mới 07 Red Letter Day - Đỏ Thuần 5g, 198.000 ₫, 21%, 250.000 ₫, 
Mise en scène, Tinh Chất Dưỡng Tóc Mise en scène Giúp Tóc Chắc Khoẻ 80ml, 239.000 ₫, 17%, 289.000 ₫, 
Liese, Bọt Kem Nhuộm Tóc Liese Màu Nâu Đỏ Provence Rose 108ml, 159.000 ₫, 33%, 239.000 ₫, 
3CE, Son Bóng 3CE Căng Mọng Little Ground - Cam San Hô 3g, 358.000 ₫, 6%, 380.000 ₫, 
3CE, Son Bóng 3CE Căng Mọng High Roller - Cam Cổ Điển 3g, 358.000 ₫, 6%, 380.000 ₫, 
Bio-essence, Combo 3 Mặt Nạ Bio-essence Mẫu Đơn Hoàng Cung 20ml, 69.000 ₫, 15%, 81.000 ₫, 
Black Rouge, Son Kem Lì Black Rouge A44 Roasting Brown - Nâu Cháy 4.5g, 186.000 ₫, 38%, 298.000 ₫, 
City Color, Bảng Tạo Khối Và Bắt Sáng City Color 4 Ô 3.88g, 124.000 ₫, 62%, 330.000 ₫, 
Naris Cosmetics, Son Thỏi Naris Cosmetics Mịn Môi 100 - Hồng Phớt 3g, 495.000 ₫, not available, not available, 
Naris Cosmetics, Son Thỏi Naris Cosmetics Mịn Môi 101 - Hồng Đào 3g, 495.000 ₫, not available, not available, 
Naris Cosmetics, Son Thỏi Naris Cosmetics Mịn Môi 102 - Hồng Cánh Sen 3g, 495.000 ₫, not available, not available, 
Cléo, Kem Tẩy Lông Cléo Dành Cho Da Thường 25g, 38.000 ₫, 21%, 48.000 ₫, 
Lebelage, Mặt Nạ Lebelage Ốc Sên Dưỡng Ẩm Da, 9.000 ₫, 40%, 15.000 ₫, 
Obagi, [Mini] Serum Obagi Cấp Nước, 369.000 ₫, 18%, 450.000 ₫, 
Colab, Dầu Gội Khô Colab Overnight Renew Tái Tạo & Phục Hồi 200ml, 117.000 ₫, 48%, 225.000 ₫, 
3CE, Son Thỏi 3CE Mịn Lì In The Fog - Màu Hồng Tím Nude 4g, 429.000 ₫, 2%, 440.000 ₫, 
LEMONADE, Phấn Nước Lemonade A02 Natural Da Trung Bình 14g + 2g, 367.000 ₫, 20%, 459.000 ₫, 
P/S, Bộ 3 Kem Đánh Răng P/S Giảm Ê Buốt Bạc Hà Thơm Mát 100g, 148.000 ₫, 10%, 165.000 ₫, 
Gennie, Nước Hoa Nữ Gennie Little Rose Dress Bản Giới Hạn 10ml, 99.000 ₫, 45%, 179.000 ₫, 
D-na, Kem Dưỡng D-Na Dưỡng Sáng Chuyên Sâu, 295.000 ₫, 20%, 370.000 ₫, 
Nivea, Kem Chống Nắng Nivea Dưỡng Sáng Mịn Hoa Hồng Hokkaido 40ml, 193.000 ₫, 3%, 199.000 ₫, 
Freeplus, Bọt Rửa Mặt Freeplus Sạch Sâu Và Dưỡng Ẩm Da 150ml, 396.000 ₫, 20%, 497.000 ₫, 
3CE, Dầu Tẩy Trang 3CE Làm Sạch Sâu, 189.000 ₫, 1%, 190.000 ₫, 
Diana, Băng Vệ Sinh Diana Siêu Thấm Cool Fresh Không Cánh 8 Miếng, 19.000 ₫, 5%, 20.000 ₫, 
Dermal, Mặt Nạ Dermal Chiết Xuất Vitamin Làm Sáng Da 23g, 9.000 ₫, 36%, 14.000 ₫, 
Diana, Băng Vệ Sinh Diana Siêu Mỏng Không Cánh Gói 8 Miếng, 20.000 ₫, 5%, 21.000 ₫, 
Cathy Doll, Kem Nền Cathy Doll Mịn Lì 01 Ivory - Da Sáng Hồng 30g, 269.000 ₫, not available, not available, 
Anjo Professional, Kem Nền Anjo Professional Chống Nắng Tinh Chất Ốc Sên 50g, 120.000 ₫, 23%, 155.000 ₫, 
eZn, Thuốc Nhuộm Tóc eZn Budapest Deep Black - Màu Đen 280g, 180.000 ₫, 23%, 235.000 ₫, 
eZn, Thuốc Nhuộm Tóc eZn Cranberry Wine - Tím Đỏ 280g, 180.000 ₫, 23%, 235.000 ₫, 
eZn, Thuốc Nhuộm Tóc eZn Peony Pink Toner - Màu Hồng 280g, 180.000 ₫, 23%, 235.000 ₫, 
eZn, Thuốc Nhuộm Tóc eZn Ash Beige Gray - Xám Tro 280g, 180.000 ₫, 23%, 235.000 ₫, 
L'Oreal, Nước Tẩy Trang L'Oreal Tươi Mát Cho Da Dầu, 158.000 ₫, 28%, 219.000 ₫, 
Klairs, Nước Hoa Hồng Klairs Không Mùi Cho Da Nhạy Cảm 180ml, 266.000 ₫, 35%, 409.000 ₫, 
La Roche-Posay, Kem Chống Nắng La Roche-Posay Kiểm Soát Dầu SPF50+ 50ml, 396.000 ₫, 26%, 535.000 ₫, 
Skin1004, Kem Chống Nắng Skin1004 Cho Da Nhạy Cảm SPF 50+ 50ml, 276.000 ₫, 35%, 425.000 ₫, 
L'Oreal, Nước Tẩy Trang L'Oreal Làm Sạch Sâu Trang Điểm 400ml, 159.000 ₫, 27%, 219.000 ₫, 
Anessa, Sữa Chống Nắng Anessa Dưỡng Da Kiềm Dầu 60ml, 393.000 ₫, 45%, 715.000 ₫, 
Bioderma, Nước Tẩy Trang Bioderma Dành Cho Da Nhạy Cảm 500ml, 393.000 ₫, 25%, 525.000 ₫, 
CeraVe, Sữa Rửa Mặt CeraVe Sạch Sâu Cho Da Thường Đến Da Dầu 473ml, 389.000 ₫, 12%, 440.000 ₫, 
Bioderma, Nước Tẩy Trang Bioderma Dành Cho Da Dầu & Hỗn Hợp 500ml, 393.000 ₫, 25%, 525.000 ₫, 
Anessa, Sữa Chống Nắng Anessa Cho Da Nhạy Cảm & Trẻ Em 60ml, 393.000 ₫, 45%, 715.000 ₫, 
Cosrx, Gel Rửa Mặt Cosrx Tràm Trà, 118.000 ₫, 65%, 339.000 ₫, 
Hatomugi, Sữa Tắm Hatomugi Dưỡng Ẩm, 80.000 ₫, 65%, 230.000 ₫, 
La Roche-Posay, Nước Tẩy Trang La Roche-Posay Dành Cho Da Nhạy Cảm 400ml, 370.000 ₫, 25%, 495.000 ₫, 
L'Oreal, Nước Tẩy Trang L'Oreal Dưỡng Ẩm Cho Da Thường, 159.000 ₫, 27%, 219.000 ₫, 
La Roche-Posay, Kem Dưỡng La Roche-Posay Giúp Phục Hồi Da Đa Công Dụng 40ml, 310.000 ₫, 21%, 390.000 ₫, 
Cathy Doll, Má Hồng Cathy Doll Dạng Kem 04 Morning Dear 6g, 159.000 ₫, not available, not available, 
Kissme, Bộ Kissme Mascara Dài Mi Và Tẩy Trang Mi Bản Giới Hạn, 359.000 ₫, 10%, 399.000 ₫, 
Foodaholic, Mặt Nạ Foodaholic Glutathione Dưỡng Sáng, 12.000 ₫, 40%, 20.000 ₫, 
S.O.B, Nước Tẩy Trang S.O.B Làm Sạch Da, 179.000 ₫, 63%, 480.000 ₫, 
Silkygirl, Son Kem Lì 2In1 Silkygirl 01 Honey Peach Cam Đào Nude 3.8ml, 177.000 ₫, 1%, 178.000 ₫, 
Freeplus, Mặt Nạ Freeplus Dưỡng Ẩm Dịu Nhẹ Hộp 5 Miếng 25mlx5, 310.000 ₫, 31%, 448.000 ₫, 
LipIce, Son Dưỡng LipIce Không Màu Chuyển Kem Mịn Hương Táo 4.3g, 51.000 ₫, 20%, 63.500 ₫, 
Jmella, Sữa Tắm Jmella Hương Cỏ An Đê Hít Và Vanilla Quyến Rũ 500ml, 119.000 ₫, 30%, 170.000 ₫, 
Eucryl, Combo 2 Bột Làm Trắng Răng Eucryl Hương Bạc Hà 50g, 98.000 ₫, 35%, 150.000 ₫, 
X-Men For Boss, Tắm Gội X-Men For Boss Intense 2in1 Hương Trầm Nội Lực 650g, 178.000 ₫, 18%, 218.000 ₫, 
Silkygirl, [HSD 05/2024] Bảng Phấn Mắt 6 Màu Silky Girl 02 Blossom, 69.000 ₫, 65%, 196.000 ₫, 
JMsolution, Gel Dưỡng Ẩm JMsolution Chiết Xuất Lô Hội Làm Dịu Da 300g, 71.000 ₫, 21%, 90.000 ₫, 
De Memoria, Nước Hoa Nữ De Memoria EDP #07 Hoian 30ml, 354.000 ₫, 36%, 550.000 ₫, 
Closeup, Combo 3 Kem Đánh Răng Closeup Acai Berry Detox 230g, 118.000 ₫, 23%, 153.000 ₫, 
Sunplay, Combo Sữa Chống Nắng Sunplay Và Tinh Chất Melano CC Sáng Da 2 Món, 412.000 ₫, 15%, 485.000 ₫, 
Lilybyred, Chì Kẻ Mắt Lilybyred Siêu Mảnh Lâu Trôi 01 Đen Tuyền 0.14g, 108.000 ₫, 36%, 169.000 ₫, 
australis, Che Khuyết Điểm Và Tạo Khối Australis Tông Tự Nhiên 7.5ml (Mới), 176.000 ₫, 20%, 220.000 ₫, 
MAYAN, Khẩu Trang Mayan 3D Pm2.5 Kids++ 5 Cái (Màu Ngẫu Nhiên), 22.000 ₫, 21%, 28.000 ₫, 
3CE, Son Thỏi 3CE Mịn Lì Apricot Filter - Màu Nude San Hô 4g, 352.000 ₫, 20%, 440.000 ₫, 
X-Men For Boss, Xịt Khử Mùi X-Men For Boss Motion Năng Động Tươi Mát 150ml, 90.000 ₫, 23%, 117.000 ₫, 
Dr.ForHair, Dầu Xả Dr.ForHair Dưỡng Tóc Suôn Mượt 50ml, 117.000 ₫, 34%, 178.000 ₫, 
Closeup, Combo 3 Kem Đánh Răng Closeup Thơm Mát Bất Tận Bạc Hà The Mát 230g, 118.000 ₫, 13%, 135.000 ₫, 
Nivea, Sữa Dưỡng Thể Nivea Mịn Mượt Sáng Da Ban Ngày 550ml, 183.000 ₫, 3%, 189.000 ₫, 
Colab, Dầu Gội Khô Colab Paradise Hương Địa Đàng 200ml, 117.000 ₫, 40%, 195.000 ₫, 
Nature Republic, Combo 5 Mặt Nạ Nature Republic Chiết Xuất Tràm Trà Giảm Mụn 23ml, 70.000 ₫, 26%, 95.000 ₫, 
Avander, Mặt Nạ Avander Chiết Xuất Nha Đam Dưỡng Sáng Da 25g, 10.000 ₫, 29%, 14.000 ₫, 
Renuzit, Sáp Thơm Phòng Renuzit Hương Táo & Quế 198g, 35.000 ₫, 22%, 45.000 ₫, 
Daiichi Sekken, Sữa Tắm Daiichi Sekken Purefeel Hương Mã Tiên Thảo 450ml, 175.000 ₫, not available, not available, 
Glamrr Q, Son Kem Lì Glamrr Q 11 Set Sail - Cam Gạch Trầm 5g, 175.000 ₫, 30%, 250.000 ₫, 
MEISHOKU, Sữa Rửa Mặt Meishoku Ngăn Ngừa Mụn 80g, 174.000 ₫, 43%, 304.000 ₫, 
LEMONADE, [HSD 06/2024] Son Kem Lì 2 Đầu Lemonade 03 Tea Đỏ Nâu Đất Bản Mới 7.5g, 123.000 ₫, 59%, 299.000 ₫, 
VACOSI, Bông Phấn Khô Vacosi Tròn Lớn BP09 (1 Cái), 25.000 ₫, not available, not available, 
3CE, [HSD 03/2024] Son Thỏi 3CE Mịn Lì 224 Delicate - Tím Hồng 3.5g, 70.000 ₫, 80%, 358.000 ₫, 
Organic Shop, Bộ Chăm Sóc Tóc Organic Shop Tạo Độ Phồng Tóc 3 Món, 349.000 ₫, 45%, 637.000 ₫, 
B.O.M, Chì Kẻ Mày B.O.M Siêu Mảnh Màu 02 Nâu Đậm 0.1g, 174.000 ₫, 20%, 218.000 ₫, 
Ma:nyo, Serum Ma:nyo Galac Niacin 2.0 Dưỡng Sáng Da 50ml, 417.000 ₫, 40%, 696.000 ₫, 
P/S, Combo 2 Nước Súc Miệng P/S Active Defense Kháng Khuẩn 500ml, 174.000 ₫, 17%, 210.000 ₫, 
Enchanteur, Xịt Khử Mùi Enchanteur Hương Nước Hoa Romantic 150ml, 95.000 ₫, 1%, 96.000 ₫, 
Hada Labo, Gel Dưỡng Ẩm Hada Labo Ngừa Lão Hóa, 263.000 ₫, 25%, 350.000 ₫, 
Garnier, Mặt Nạ Garnier Tinh Chất Trà Xanh Kiểm Soát Dầu 28g, 24.000 ₫, 17%, 29.000 ₫, 
L'Oreal, Nước Tẩy Trang L'Oreal Tươi Mát Cho Da Dầu, 158.000 ₫, 28%, 219.000 ₫, 
Klairs, Nước Hoa Hồng Klairs Không Mùi Cho Da Nhạy Cảm 180ml, 266.000 ₫, 35%, 409.000 ₫, 
La Roche-Posay, Kem Chống Nắng La Roche-Posay Kiểm Soát Dầu SPF50+ 50ml, 396.000 ₫, 26%, 535.000 ₫, 
Skin1004, Kem Chống Nắng Skin1004 Cho Da Nhạy Cảm SPF 50+ 50ml, 276.000 ₫, 35%, 425.000 ₫, 
L'Oreal, Nước Tẩy Trang L'Oreal Làm Sạch Sâu Trang Điểm 400ml, 159.000 ₫, 27%, 219.000 ₫, 
Anessa, Sữa Chống Nắng Anessa Dưỡng Da Kiềm Dầu 60ml, 393.000 ₫, 45%, 715.000 ₫, 
Bioderma, Nước Tẩy Trang Bioderma Dành Cho Da Nhạy Cảm 500ml, 393.000 ₫, 25%, 525.000 ₫, 
CeraVe, Sữa Rửa Mặt CeraVe Sạch Sâu Cho Da Thường Đến Da Dầu 473ml, 389.000 ₫, 12%, 440.000 ₫, 
Bioderma, Nước Tẩy Trang Bioderma Dành Cho Da Dầu & Hỗn Hợp 500ml, 393.000 ₫, 25%, 525.000 ₫, 
Anessa, Sữa Chống Nắng Anessa Cho Da Nhạy Cảm & Trẻ Em 60ml, 393.000 ₫, 45%, 715.000 ₫, 
Cosrx, Gel Rửa Mặt Cosrx Tràm Trà, 118.000 ₫, 65%, 339.000 ₫, 
Hatomugi, Sữa Tắm Hatomugi Dưỡng Ẩm, 80.000 ₫, 65%, 230.000 ₫, 
La Roche-Posay, Nước Tẩy Trang La Roche-Posay Dành Cho Da Nhạy Cảm 400ml, 370.000 ₫, 25%, 495.000 ₫, 
L'Oreal, Nước Tẩy Trang L'Oreal Dưỡng Ẩm Cho Da Thường, 159.000 ₫, 27%, 219.000 ₫, 
La Roche-Posay, Kem Dưỡng La Roche-Posay Giúp Phục Hồi Da Đa Công Dụng 40ml, 310.000 ₫, 21%, 390.000 ₫, 
Double Rich, Kem Xả Double Rich Giúp Tóc Chắc Khỏe 250ml, 69.000 ₫, not available, not available, 
On: The Body, Sữa Rửa Mặt On: The Body Chiết Xuất Diếp Cá Cho Da Mụn 150g, 115.000 ₫, 21%, 145.000 ₫, 
Sunplay, Combo 2 Tinh Chất Chống Nắng Sunplay Hiệu Chỉnh Sắc Da 50g (Tím), 314.000 ₫, 15%, 370.000 ₫, 
Senka, [Mini] Nước Sữa Tẩy Trang Senka 2 Lớp Sạch Sâu & Dịu Mát 70ml, 49.000 ₫, not available, not available, 
Organic Shop, Tẩy Da Chết Toàn Thân Organic Shop Hương Mật Ong Quế 250ml, 79.000 ₫, 53%, 169.000 ₫, 
Frudia, Kem Dưỡng Da Tay Frudia Chiết Xuất Măng Cụt 30ml, 49.000 ₫, 32%, 72.000 ₫, 
It'S SKIN, Mặt Nạ It's Skin Hyaluronic Acid Dưỡng Ẩm Sâu Cho Da 17g, 17.000 ₫, 23%, 22.000 ₫, 
Milaganics, Xà Phòng Milaganics Thảo Mộc Trà Xanh 100g, 68.000 ₫, 36%, 107.000 ₫, 
innisfree, Mặt Nạ innisfree Chăm Sóc Lỗ Chân Lông 100ml, 340.000 ₫, not available, not available, 
Cathy Doll, Chì Kẻ Mày Cathy Doll 2 Màu Trong 1 #01 Dark Brown 1g+1g, 85.000 ₫, not available, not available, 
Cathy Doll, Kẻ Mày Cathy Doll 3 Trong 1 #01 Dark Brown 0.16g + 0.4g, 134.000 ₫, 21%, 169.000 ₫, 
L'Oreal, Kem Nhuộm L'Oreal Dưỡng Tóc Sâu 5.62 Nâu Ánh Tím 172ml, 169.000 ₫, 15%, 199.000 ₫, 
innisfree, Mặt Nạ Giấy innisfree Dưỡng Sáng Rạng Rỡ Từ Quýt Yuzu 22ml, 20.000 ₫, 26%, 27.000 ₫, 
Bamboo Salt, Bàn Chải Đánh Răng Bamboo Salt In Mom Chăm Sóc Nướu (1 Cây), 41.000 ₫, 9%, 45.000 ₫, 
Naris Cosmetics, Lót Dưỡng Môi Naris Ngừa Nhăn Và Bảo Vệ Môi 10g, 335.000 ₫, not available, not available, 
Naris Cosmetics, Son Lì Naris Ailus Mịn Môi Màu 03 Cam 4g, 335.000 ₫, not available, not available, 
Naris Cosmetics, Son Lì Naris Ailus Mịn Môi Màu 05 Hồng Đào 4g, 335.000 ₫, not available, not available, 
Gillette, Lưỡi Dao Cạo Râu Gillette Mach3 Sensitive Vỉ 4 Cái, 334.000 ₫, not available, 335.000 ₫, 
Suri, Bông Phấn Ướt Suri E376 (Bịch 2 Miếng), 37.000 ₫, 14%, 43.000 ₫, 
Cocoon, Combo Cocoon Nước Tẩy Trang 140ml + Tinh Chất Bí Đao Giảm Dầu Mụn, 352.000 ₫, 20%, 440.000 ₫, 
HASI, Sữa Tắm Hasi Kokeshi Sữa Bò & Ngọc Trai Sáng Mịn Da 950ml, 165.000 ₫, 9%, 182.000 ₫, 
Double Rich, Kem Nhuộm Tóc Double Rich Màu 12N Nâu Ánh Vàng 60g, 154.000 ₫, 1%, 155.000 ₫, 
Mediheal, Mặt Nạ Mediheal Làm Mịn, 15.000 ₫, 48%, 29.000 ₫, 
So'Natural, Sữa Rửa Mặt Kimsohyung Chiết Xuất Thảo Dược 145g, 329.000 ₫, 22%, 420.000 ₫, 
Neutrogena, Combo Neutrogena Nước Tẩy Trang + Kem Dưỡng Cho Da Dầu, 228.000 ₫, 31%, 330.000 ₫, 
Gillette, Dao Cạo Nữ Gillette Daisy (Gói 2 Cây), 20.500 ₫, 5%, 21.500 ₫, 
Nivea, Lăn Khử Mùi Nivea Shaveless Ngọc Trai Đẹp Quyến Rũ 50ml, 81.000 ₫, 12%, 92.000 ₫, 
Flawsome, Son Trang Điểm Flawsome Best Part - Đỏ Nâu 3g, 175.000 ₫, 20%, 220.000 ₫, 
Black Rouge, Son Tint Black Rouge LZ02 Apple Greek Yogurt Hồng Lạnh 4g, 164.000 ₫, 48%, 318.000 ₫, 
Nivea, Lăn Khử Mùi Nivea Happy Shave Sáng Mịn Làm Dịu Da 50ml, 89.000 ₫, 3%, 92.000 ₫, 
JMsolution, Mặt Nạ JMsolution Thanh Yên & Mật Ong Cấp Ẩm, 39.000 ₫, not available, not available, 
Bio-essence, [Mini] Combo 3 Serum Bio-essence Cao Cấp Thúc Đẩy Dưỡng Sáng Da 30ml, 325.000 ₫, 10%, 360.000 ₫, 
B.O.M, Mascara B.O.M Làm Dày & Cong Mi 01 Màu Đen 8g, 323.000 ₫, 7%, 348.000 ₫, 
Unpa, Son Dưỡng Môi Unpa Bubi Bubi Butter Dưỡng Ẩm Mềm Mại 3.8g, 108.000 ₫, 50%, 217.000 ₫, 
Bioré, Combo 2 Serum Chống Nắng Dưỡng Thể Bioré Sáng Da Mịn Màng 150ml, 336.000 ₫, 22%, 432.000 ₫, 
It'S SKIN, Mặt Nạ It's Skin Chiết Xuất Tràm Trà Ngăn Ngừa Mụn 18g, 17.000 ₫, 23%, 22.000 ₫, 
Nature Republic, Mặt Nạ Nature Republic Chiết Xuất AHA Sáng Mịn Da 24g, 19.000 ₫, 24%, 25.000 ₫, 
Bioderma, Nước Tẩy Trang Bioderma Dành Cho Da Dầu & Hỗn Hợp 20ml, 19.000 ₫, 68%, 60.000 ₫, 
